ID,Language_ID,Primary_Text,Analyzed_Word,Gloss,Translated_Text,Meta_Language_ID,Comment,Corpus_Reference,Example_Comment_English,Example_URL,Sense_IDs,alt_translation1
XV002087,tkw,"Ebel' ini me, pe a-venei network na.",,,It's a great thing that [lit. because] you set up this network.,,,https://www.facebook.com/groups/1253287941406185/?post_id=1253291688072477&comment_id=1277714545630191,,,SN001687,
XV002088,tkw,Pe ive?,,,Why?,,,,,,SN001687,
XV002089,tkw,Ne-tau namuko enaka ne-kae? Pe iawo i-bu.,,,How will I be able to cook my fish? [indeed] our fire died out!,,,Heron.Tnm.08,,,SN001688,
XV002090,tkw,Ia enon' iot' tae! Pe enone na iune na.,,,But I don't have another (knife). [indeed] this is my only one.,,,d11.Wora:11,,,SN001688,
XV002091,tkw,Awis pine peini ngatene pe a-la ponu.,,,Many thanks for your work [lit. for the things you've taken],,,,,,SN001689,
XV002092,tkw,"Vao, we pe li-womanga?",,,"Is it wild, or tame? [wild, or that we feed?]",,,,predicate,,SN001689,
XV002093,tkw,basavono pe li-anu kava,,,during kava-drinking moments [lit. (at the) moment that we drink kava],,,,,,SN001689,
XV002094,tkw,ne bogo pe la-kila da,,,on their wedding day [lit. the day that they married],,,,,,SN001689,
XV002095,tkw,udo pe i-ako,,,[banana that is ripe] ripe banana,,,,,,SN001690,
XV002096,tkw,jokoro pe li-vi,,,[bamboo that people blow] Pan pipe,,,,,,SN001690,
XV002097,tkw,moe pe li-apinu ene,,,[house we cook inside] kitchen,,,,,,SN001690,
XV002098,tkw,die mwaliko pe i-bu,,,the bones of a dead body [of a person that died],,,q.Body.112,,,SN001690,
XV002099,tkw,Da viñevi wopine li-ovei pe li-anu kava.,,,Adult women can drink kava.,,,Kava.22,,,SN001691,
XV002100,tkw,I-mui pe i-mo.,,,He cannot speak.,,,,,,SN001691,
XV002101,tkw,Emel' enone i-mete ini pe i-rom dokta.,,,My wife is (too) shy to see the doctor.,,,,,,SN001691,
XV002102,tkw,votobo pe le-sava tilu,,,it's better / it's enough to buy two.,,,,,,SN001691,
XV002103,tkw,Tamwaliko pe i-vio ne kulumoe iono ñoko.,,,It would be a shame if (this plant) only grew in your village.,,,Kaori.30,,https://doi.org/10.24397/pangloss-0003353#S30,SN001691,
XV002104,tkw,A-mene pe u-e none ponu?,,,Aren't you tired of eating that food?,,,,,,SN001691,
XV002105,tkw,Ni-garei eo pe u-le re!,,,I forbid you from going there!,,,HP1-05a,,,SN001691,
XV002106,tkw,"Pe li-anu kava, ebele idi motoro.",,,"When you drink kava, you feel your body is heavy.",,,,,,SN001692,
XV002107,tkw,Ni-lengi ni-p' ene tamwase.,,,I was very happy to hear (the news).,,,,,,SN001695,
XV002108,tkw,"Kiapa ka li-pei kiapa, pe menuko iakapa dapa Frans.",,,"We are all delighted, because the French are our friends.",,,,,,SN001695,
XV002109,tkw,Ba-pei keba ñe moe iaba.,,,We're quite happy with / fond of our house.,,,DP1-12b,,,SN001696,
XV002110,tkw,Ni-pei ene ñ’ eo.,,,[I'm glad about you] I like you.,,,HP1-04a,,,SN001696,
XV002111,tkw,A-p' eo ñei?,,,Do you like it?,,,DP1-12b,,,SN001696,
XV002112,tkw,Li-pe idi pe bwogo pe li-ve eo ene!,,,Happy birthday! [lit. Let's rejoice about the day when you were born!],,,check!,,,SN001697,
XV002113,tkw,U-pei ñe ene etapu!,,,Don't sulk at me!,,,DP1-30b,,,SN001698,
XV002114,tkw,velebie peini otovo,,,sago starch,,,DP1-29b,,,SN001699,
XV002115,tkw,abilo peini revo,,,[snake of the sea] seasnake,,,,,,SN001699,
XV002116,tkw,dapa wopine peini kulumoe,,,the high chiefs of the island,,,,,,SN001699,
XV002117,tkw,sekele peini jebute,,,taro garden,,,,,,SN001700,
XV002118,tkw,Mwaliko peini vilo!,,,[a man of plants] a plant connoisseur,,,DG2-11b,,,SN001700,
XV002119,tkw,piene peini toñaki ie Laperus,,,the story of Lapérouse's ship,,,Lap-Simevio.18,,,SN001701,
XV002120,tkw,piene peini li-katei kuo,,,[the story of we draw canoes] the story about pulling canoes,,,Dragging_Canoe.43,,,SN001702,
XV002121,tkw,Ka pi-ovei buro peini.,,,We know the song (about it).,,,Tamate.182,,,SN001703,
XV002122,tkw,"Temaka na, iepiene peini i-wene.",,,This place has stories attached to it.,,,DP1-23b,,,SN001703,
XV002123,tkw,"Buka ono po, tone peini tivi?",,,"Your notebook, how much was its price?",,,HP1-04a,,,SN001703,
XV002124,tkw,"Diro, li-avi otovo; awoiu li-la iadiro peini, li-bo diro.",,,"You collect sago leaves; take out their midribs, and sharpen them into darts.",,,AF-IP1-03a,,,SN001703,
XV002125,tkw,"None na, peini melevele pine.",,,This food is good in case of a major famine.,,,DP1-29b,,,SN001704,
XV002126,tkw,mata pele,,,mesh of a fishnet,,,,,,SN001707,
XV002127,tkw,li-re pele / li-ali pele,,,"practise netfishing, cast the net",,,d11.Wora:07,,,SN001707,
XV002128,tkw,"Pele iono i-tatawoe ne temaka ene, ka ere.",,,"Your fishnet is torn here, and there.",,,d11.Wora:10,,,SN001707 ; SN002073,
XV002129,tkw,Li-si pele peini anuele.,,,They made a net for hunting turtles.,,,DG1-26a,,,SN001707 ; SN001873,
XV002130,tkw,Li-pidi jokoro.,,,They're playing the bamboo drum (using sticks).,,,DG1-17a,,,SN001712,
XV002131,tkw,Li-pidi revo.,,,They're splashing the surface of the sea (e.g. to frighten the fish),,,DG1-17a,,,SN001712,
XV002132,tkw,U-pidi ini etapu!,,,Don't whip him!,,,DG1-17a,,,SN001713,
XV002133,tkw,pi' iape,,,his/her grandfather,,,,,,SN001714,
XV002134,tkw,Pie ! A-ko u-ka vele ?,,,"Hey, my namesake! Where are you going?",,,2017-07-16,,,SN001716,
XV002135,tkw,vese piene → vesepiene,,,bits of speech → words,,,,,,SN001717,
XV002136,tkw,ebele piene,,,true words → truth,,,,,,SN001717,
XV002137,tkw,~vete piene,,,"say words → talk, speak",,,,,,SN001717,
XV002138,tkw,~wablei piene,,,tease words → joke,,,,,,SN001717,
XV002139,tkw,U-wasu piene 'none.,,,[fix my words] Please correct my mistakes.,,,DP1-32a,,,SN001717 ; SN002560,
XV002140,tkw,piene adapa Teanu,,,the Teanu language,,,,,,SN001718,
XV002141,tkw,piene adapa Tetawo,,,the Tanema language,,,,,,SN001718,
XV002142,tkw,piene akapa,,,our language (usually meaning that of Teanu),,,,,,SN001718,
XV002143,tkw,piene damala,,,[Westerners' language] Pijin,,,DP1-05a,,,SN001718,
XV002144,tkw,piene adapa wopine,,,"[language of elders] formal register, poetic style",,,,,,SN001718,
XV002145,tkw,Ni-lengi pieni peini dapa.,,,I've heard the news about them.,,,DP1-18b,,,SN001720,
XV002146,tkw,Ponu piene tamwaliko pe noma; ka awoiu.,,,That's a bad thing of the past; it's over now.,,,DG1-24a,sorcery,,SN001721,
XV002147,tkw,toñaki pine,,,a large ship,,,,,,SN001727,
XV002148,tkw,monon' enaka iote pine,,,a huge wooden trunk of mine,,,,,,SN001727,
XV002149,tkw,"Kuo demene, li-la ngatene ñi pine tamwase.",,,Outrigger canoes are too much work. [working at them is too big],,,DG1-04b,,,SN001728,
XV002150,tkw,"Nganae pine tae ponu, ne-ko n-ovei eo a-te vele?",,,Just a small question [lit. not a major thing]: I wanted to know where you live.,,,EP_2012-03-28.03,,,SN001729,
XV002151,tkw,Awis pine!,,,[big thanks] Thank you very much!,,,,,,SN001729,
XV002152,tkw,"Sande, moro pine, pe li-langatene tae, pe li-tamava.",,,"Sunday is an important day – one when we don't work, and pray.",,,DG1-17b,,,SN001730,
XV002153,tkw,Iepiene pine.,,,It's an important myth.,,,DP1-17a,,,SN001730,
XV002154,tkw,mwaliko pine,,,"great man, chief, leader",,,,,,SN001730,
XV002155,tkw,"En' na dameliko tae, ene na ka mwaliko pine.",,,"I'm not a child, I'm a grown person!",,,d05.Naef:44,,,SN001731,
XV002156,tkw,emele pine tamwase,,,a very old woman,,,DP1-06b,,,SN001731,
XV002157,tkw,La-womanga men' iada ra ra pine.,,,They fed their child until he grew up.,,,,,,SN001732,
XV002158,tkw,"Li-ve ini Vonovono, ia ini pine Honiara.",,,"She was born in the Reef Islands, but she grew up in Honiara.",,,DP1-07b,,,SN001732,
XV002159,tkw,"Wa bale we Ginio, pi-pinoe ñei.",,,We use ankle rattles to perform our dances.,,,DP2-20b,,,SN001733 ; SN002501,
XV002160,tkw,"Li-wate tepapa, li-viane tepapa ponu; ka li-pinoe pon ta ka li-mako.",,,"They were hitting the boards, stomping on the boards: such was their dance.",,,Lupo.30,,,SN001733 ; SN002101,
XV002161,tkw,Ni-e kulevelu tilu piote.,,,I ate two whole chickens.,,,DG1-48b,,,SN001734,
XV002162,tkw,wik iune piote,,,one full week,,,DG1-48b,,,SN001734,
XV002163,tkw,pi’ one,,,my grandfather,,,,,,SN001735,
XV002164,tkw,"Buka ono po, tone peini tivi?",,,"That notebook of yours, how much did it cost?",,,HP1-04a,,,SN001736,
XV002165,tkw,Ka mwaliko po i-ko “Wako.”,,,The man said “Alright.”,,,Tamate.087,recognitional use,,SN001736,
XV002166,tkw,"Tepapa i-dai ka ne mane po, li-vo aero i-dai.",,,The stomping boards were laid out all around the dancing area; then they erected a fence around them.,,,Tamate.126,clause topicalizer ([ponu](ponu_1)),https://doi.org/10.24397/pangloss-0003351#S126,SN001736,
XV002167,tkw,mwaliko po i-bu,,,the man who died,,,,,,SN001737,
XV002168,tkw,Basa iupa re po i-wen’ iu re,,,that mountain of ours that is up over there,,,Paradise.03,,,SN001737,
XV002169,tkw,ne moro po kape le-le le-katei kuo ene,,,the day when they were going to drag the canoe,,,Dragging_Canoe.15,,,SN001737,
XV002170,tkw,Minga kape le-sune angede ovene po Laperus i-si ponu.,,,One day someone will find the message that was written by Lapérouse.,,,Lap'Message_11,,https://doi.org/10.24397/pangloss-0003270#S11,SN001737,
XV002171,tkw,"Noma, po apali i-maili i-ven' i-ka, i-te tev' ai' iape me et' iape.",,,"In the old days, when a child grew up, he would stay with his parents.",,,,,,SN001738,
XV002172,tkw,"U-tau awoiu po moioe, u-ovei pe u-e.",,,"Once you've cooked it and it's done, you can eat it.",,,q.Rerem.03,,,SN001738,
XV002173,tkw,"Basavono po li-ve dameliko, nga emele kape li-abu dapa.",,,"When female children were born, they would be killed.",,,DG1-24b,relative with noun [basavono](basavono_1),,SN001739,
XV002174,tkw,Makumoso na? – Makumoso pon ta.,,,Is this your firstborn (child)? – Correct! That's my firstborn.,,,DP1-28a,,,SN001742,
XV002175,tkw,Pon ta! Susuko pon.,,,That’s it! That's correct.,,,,,,SN001742,
XV002176,tkw,Awa eo i-viaene ñe ponda.,,,Now that’s the reason why you love her.,,,DP1-13a,,,SN001742,
XV002177,tkw,I-ko me kap’ emel’ iape pon ta.,,,He wanted her to become his wife. [wanted that his wife would be that one],,,Mwasu.065,,https://doi.org/10.24397/pangloss-0003352#S65,SN001742,
XV002178,tkw,Ka awoiu pon ta.,,,So that's how my story ends.,,,Lupo.75,closing formula,,SN001743,
XV002179,tkw,Katae ka ni-e pon ta!,,,That was my first time ever eating this!,,,DP2-09b,,,SN001743,
XV002180,tkw,"Nga namuko i-pono eo, kape sa eo i-meli.",,,"If fish poisons you, your stomach will ache.",,,q.Fish.002,,,SN001746,
XV002181,tkw,ne utele vewo pine ponu,,,by that big chestnut tree over there,,,"DG1-08b, DG2-10b",,,SN001747,
XV002182,tkw,U-le pon etapu!,,,Don't go there! (where you're about to go),,,Mwasu.058,,https://doi.org/10.24397/pangloss-0003352#S58,SN001747,
XV002183,tkw,Kape u-ali pele po a-labu ponu?,,,Will you be casting that net you're holding?,,,,,,SN001747,
XV002184,tkw,nga pon,,,"like that, like you're doing",,,,,,SN001747,
XV002185,tkw,U-wai ebele u-ka pon etapu!,,,Don't shake your body like that!,,,DG4-03a,,,SN001747,
XV002186,tkw,Awis pine peini ngatene pe a-la ponu.,,,Thank you for your efforts. [lit. for those things you did],,,,,,SN001747,
XV002187,tkw,"Pon kaiawo tae, ova revo.",,,"That's not smoke, that's steam.",,,d10.Bekem:26,,,SN001748,
XV002188,tkw,Basavono pon ene mamote apali.,,,"At that time [you're talking about], I was still a child.",,,,,,SN001748,
XV002189,tkw,Okoro 'naka pon i-wene vele?,,,So where's that knife of mine (we're talking about)?,,,,,,SN001748,
XV002190,tkw,Ponu nganae pine ponu? Pon tadoe? Pon tepakola?,,,What's that giant creature? Is that a god? Is that a giant?,,,Tamate.161,,https://doi.org/10.24397/pangloss-0003351#S161,SN001748,
XV002191,tkw,Li-kila temaka pon li-ko “Moe ma Tadoe”.,,,That place is called “Devils' Lair”.,,,,,,SN001748,
XV002192,tkw,Ini i-papa men' iap' pon la-ke.,,,She took her baby on her back and out they went.,,,DP1-14b,,,SN001749,
XV002193,tkw,Emele pon i-mene i-te i-etengi.,,,"The girl refused, and then she sat crying.",,,Mwasu.074,in narrative,https://doi.org/10.24397/pangloss-0003352#S74,SN001749,
XV002194,tkw,"Mwasu ponu, ini mwaliko pe i-metei dapa ne ini tae.",,,That Mwasu was a person who felt no shame with his relatives.,,,Mwasu.043,with proper name,https://doi.org/10.24397/pangloss-0003352#S43,SN001749,
XV002195,tkw,"N-atevo iepiene amjaka peini Laperus. Iepiene pon na, ni-lengi tev' et' one.",,,"I'll tell a short story about Lapérouse. This story, I heard it from my mother.",,,Lap-Simevio.01,foll. by demonstrative [na](na_1),,SN001750,
XV002196,tkw,Uña ngatene pon na pe vele?,,,"All those things, where do they come from?",,,Toplau.58,,,SN001750,
XV002197,tkw,"Toñaki ie Laperus ponu, ae, tepakare. Lovia tilu, ne?",,,"Lapérouse's ship, you know, it was a catamaran. With two sections, you see?",,,Lap-Simevio.12,,,SN001750,
XV002198,tkw,Voko iote pon li-re ne elene Lege ponu.,,,"There was once a large stone down there, in the clearing known as Lengge.",,,Lap:Usao.29,,,SN001750,
XV002199,tkw,"Dero ponu, vilo pe emele i-ve.",,,The kauri is a tree that was first born out of a woman.,,,Kaori.34,myth,https://doi.org/10.24397/pangloss-0003353#S34,SN001750,
XV002200,tkw,Ka i-mamei ponu ka i-maliawo ka i-wene teve.,,,"As she was feeling cold, she lit a fire and lied down beside it.",,,Kaori.13,,https://doi.org/10.24397/pangloss-0003353#S13,SN001751,
XV002201,tkw,Ka vitoko pe la-koie ponu la-lengi dapa.,,,"As they were about to land, they heard some voices.",,,Tamate.028,,https://doi.org/10.24397/pangloss-0003351#S27,SN001751,
XV002202,tkw,Voko i-te ponu ra ka i-vagasi nanana.,,,The stone has been there until this day.,,,Lupo.74,,,SN001751,
XV002203,tkw,Pon i-la visone iape i-ka i-ngago.,,,"So he took his bow, and strung it.",,,Tamate.032,,https://doi.org/10.24397/pangloss-0003351#S32,SN001752,
XV002204,tkw,Pon bavede i-vio pon ka la-ka.,,,"And so they sailed, heading this way.",,,Tamate.089,,https://doi.org/10.24397/pangloss-0003351#S89,SN001752,
XV002205,tkw,"Amoso Lavalu, ai-ovei ? Amoso Lavalu. Pon. Wako pon.",,,"Mr Lavalu, do you know him? Mr Lavalu. Yeah, that's right.",,,Goblins.06,,,SN001753,
XV002206,tkw,"Ka ni-mui pe ni-vete temotu ponu, enga ini “Veluko”. Pon.",,,"Oh, I forgot to say, that small islet was called “Feluko”. Alright.",,,Tamate.073,,https://doi.org/10.24397/pangloss-0003351#S73,SN001753,
XV002207,tkw,"Li-ae kie tepapa i-dadai awoiu pon, li-iu tepapa ene.",,,"They dug holes for the dancing boards all around the area, and then they buried the boards in them.",,,Tamate.122,,https://doi.org/10.24397/pangloss-0003351#S122,SN001754,
XV002208,tkw,"Li-vesu iuro; awoiu pon li-avi otovo. Li-kamai li-wete; li-wete awoiu pon li-ejau telemoe. I-su awoiu ponu ponu, i-vete “Wako”.",,,"They erected the post; after that, they went to pick sago leaves. Brought them, began sewing them; once they had sewn them, they made the roof. Once it was over, he said “Alright!”",,,Toplau.82,tail-head linkage,,SN001754,
XV002209,tkw,"Tepuke ponu, moe aplaka pon, ne pongo kuo pon.",,,"The ‘tepuke’ ship has a small cabin, on top of the ship.",,,Lap-BenTua.005,,,SN001755,
XV002210,tkw,U-pongo etapu!,,,Don't wake him up!,,,DP1-20a,,,SN001756,
XV002211,tkw,"Ka Popokia ponu, li-ko kulumoe tilu. Ka toplau pe i-wene ene toplau tilu.",,,They say that Mt Popokia has two villages. And that there are two ritual houses there.,,,Paradise.04,myth of Mt Popokia,,SN001757,
XV002212,tkw,Ata ini kape i-le ne Popokia.,,,His soul will travel to Popokia / to Paradise.,,,,abode of the Dead,,SN001758,
XV002213,tkw,Ene ni-le Popokia ka ni-tabo ni-ka Honiara pepane iote.,,,"I travelled to Vanikoro, and came back to Honiara two days ago.",,,EP_2012-05-11.01,,,SN001759,
XV002214,tkw,Tengiro i-pu i-abu.,,,His tears were running down.,,,DP2-10a,,,SN001760 ; SN002092,
XV002215,tkw,Bomb i-pu ne kulumoe.,,,A bomb exploded in the city.,,,DG4-01,,,SN001761,
XV002216,tkw,I-leng' i-ko mobo ngapiene kape ka i-pu i-sali.,,,"She heard that the next morning, the festival would break up and finish.",,,Lupo.37,,,SN001762,
XV002217,tkw,Revo i-pu viabasa ene.,,,The sea has spattered my hair.,,,HP1-08a,,,SN001763,
XV002218,tkw,Na ngele ba i-puie na?,,,Who's that talking to me?,,,Heron.Tnm.17,,,SN001764,
XV002219,tkw,uie puluko,,,[betel leaves] k.o. fish,,,,,,SN001765,
XV002220,tkw,U-te puna eo tae!,,,You keep quiet!,,,HP2-06a,,,SN001771,
XV002221,tkw,Ba-te puna kela tae!,,,"You (two), keep quiet!",,,HP2-06a,,,SN001771,
XV002222,tkw,Pe-te puna kaipa tae!,,,"You (all), keep quiet!",,,HP2-06a,,,SN001771,
XV002223,tkw,Eo a-punuo ñe okor' 'naka?,,,Did you steal my knife?,,,,,,SN001772,
XV002224,tkw,Noma vana uña toñaki van li-ka li-punuo ñe idi li-lui.,,,"In the olden days, ships used to come and kidnap people to carry them away.",,,Lap-Simevio.07,,,SN001773,
XV002225,tkw,Dapa Tukupie li-ka li-punuo.,,,The Tikopians have come (and colonised) here illegally.,,,DP1-22b,,,SN001774,
XV002226,tkw,"Puro, li-bo vilo korone, li-ejau i-vio ne viapwene.",,,"To make an arrow, you sharpen a piece of strong wood, and insert it into a reed shaft.",,,"Pae, 2017-07-17",,,SN001775,
XV002227,tkw,"Tabuluburi, tonge iote pine pe li-loko puro i-koie ene.",,,A quiver is a long basket were you can insert your arrows.,,,Mwasu.129,,https://doi.org/10.24397/pangloss-0003352#S129,SN001775,
XV002228,tkw,Pusi i-etengi.,,,The cat is meowing.,,,,,,SN001776,
XV002229,tkw,pwa tokoli,,,empty space under a house,,,,,,SN001777 ; SN002200,
XV002230,tkw,pwa motono,,,deeper ocean,,,,,,SN001777,
XV002231,tkw,Li-le li-wamu dapa ne pwa moe.,,,They went to hide under a house.,,,,,,SN001778,
XV002232,tkw,U-ko ruene me ne-ke ne-te ne pwa ruene ponu!,,,Open that (trap) door so I can hide underneath!,,,Mwasu.057,,https://doi.org/10.24397/pangloss-0003352#S57,SN001778 ; SN001827,
XV002233,tkw,Bwoe baro nga na i-wene ne pwa motono.,,,Hammerhead sharks like this live in the deep ocean.,,,HP1-09a,,,SN001778 ; SN002583,
XV002234,tkw,pwama ene,,,by my side,,,DG1-08b,,,SN001782,
XV002235,tkw,ne pwama ole,,,on the beach,,,,,,SN001783,
XV002236,tkw,Li-te ne pwama iaero re ka li-ko me kape li-apilo toñaki.,,,"They stayed on the river bank, with the plan to build a ship.",,,Lap'Message_01,,https://doi.org/10.24397/pangloss-0003270#S1,SN001783,
XV002237,tkw,"Monone po ene ni-vete, ene tawora ne, ne utele vewo pine pe i-vio ne, pwama ole ponu.",,,"That chest I was talking about was located down there, by the large chestnut tree standing over there, on the beach.",,,Lap'Treasure_01,,https://doi.org/10.24397/pangloss-0003269#S1,SN001783,
XV002238,tkw,Li-wete ra ra pwelele.,,,We pound it till it's soft.,,,IP1-06b,,,SN001784,
XV002239,tkw,Li-mali iawo ne lema awene pwo.,,,You light a fire down in the oven.,,,d10.Bekem:12,,,SN001787,
XV002240,tkw,vesengele pwoi,,,pig's snout,,,,,,SN001788 ; SN002444,
XV002241,tkw,"Poi pe li-womanga ne kulumoe, vao i-moloe ne ngogoro.",,,"Poi pigs are fed in the village, fao pigs wander about in the forest.",,,DG1-16b,,,SN001788,
XV002242,tkw,Lai-te Tetevo ra ra ra ra – ka i-le ne velesebe.,,,"So they waited on Utupua, on and on and on — till they reached the middle season.",,,Tamate.017,,https://doi.org/10.24397/pangloss-0003351#S17,SN001789,
XV002243,tkw,"Li-pinoe li-dai ra ra awoiu, li-tabo li-le ne bonge ma dapa.",,,"They dance on and on [lit. till it ends], until they return to their cave.",,,d06.Devil:16,,,SN001790,
XV002244,tkw,"Pon, i-wene ra basavono na.",,,It has remained there until today.,,,Lap'Message_10,,https://doi.org/10.24397/pangloss-0003270#S10,SN001790,
XV002245,tkw,Li-sabisi li-maliawo boso. Pon ra kokoro.,,,"They laid (the almonds) and lit a fire underneath, till they were dry.",,,Tamate.107,,https://doi.org/10.24397/pangloss-0003351#S107,SN001790,
XV002246,tkw,"Ra ra, moro iote iawo i-bu.",,,"They were living like that, but one day, the fire died out.",,,Heron.Tnm.07,,,SN001791,
XV002247,tkw,Ra jebute ka moso pon.,,,"Finally, the taro ripened.",,,Tamate.114,,https://doi.org/10.24397/pangloss-0003351#S114,SN001791,
XV002248,tkw,ravioe 'none,,,my saliva,,,HP1-06b,,,SN001795,
XV002249,tkw,Alvaki. Tetake re. Utupua re.,,,"It was in Alvaki. Out there, over there in Utupua island.",,,Hell-Door.18,,,SN001796,
XV002250,tkw,basa re po i-wen' iu re,,,that mountain up over there,,,Paradise.03,,,SN001796,
XV002251,tkw,U-le u-wasu emele re u-min' ene!,,,[Go fix that girl for me] Please go and connect me with that girl!,,,DP1-32a,,,SN001796 ; SN002563,
XV002252,tkw,U-re mevia eo.,,,[Release your breath!] Have a rest!,,,,,,SN001797,
XV002253,tkw,U-re bavede!,,,Release the sail!,,,DG1-07a+,,,SN001797,
XV002254,tkw,Voko iote pon li-re ne elene Lege ponu.,,,They took stones and laid them down in the clearing of Lengge.,,,Lap:Usao.29 = DG2-14b,,,SN001798,
XV002255,tkw,Ne-le ne-re pele.,,,I'm going net-fishing.,,,,,,SN001799,
XV002256,tkw,Ka a-romo leka! Kape u-re viko!,,,You had eye contact with your cousin! You will have to pay a fine!,,,DP2-11b,,,SN001800,
XV002257,tkw,U-re ene!,,,Leave me alone!,,,DG1-06a+,,,SN001801,
XV002258,tkw,Awa ene i-su pe ni-re kaipa damiliko iono.,,,I am sad to have left you and your family.,,,Nabu email,,,SN001803,
XV002259,tkw,A-re Bakap vele?,,,Where did you drop Bakap?,,,DG1-07b,,,SN001803,
XV002260,tkw,Ka i-re emele iape.,,,[he has released his wife] He is divorced.,,,DG1-07a,,,SN001804,
XV002261,tkw,teliki iakapa na pe ka i-re kiapa na,,,our leader who has left us today,,,,,,SN001805,
XV002262,tkw,U-re i-wene!,,,Leave it there!,,,DG1-07b,,,SN001806,
XV002263,tkw,rea iune tamana tidi,,,one hundred nine,,,,,,SN001807,
XV002264,tkw,rea tilu tamana kwatili,,,two hundred fifty,,,DP1-04a,,,SN001807,
XV002265,tkw,Le-rema Bakap i-ka.,,,Let's wait till Bakap comes.,,,DP1-21a,,,SN001808,
XV002266,tkw,Ni-wene rema eo.,,,"I was lying in bed, waiting for you.",,,DP1-21a,,,SN001809,
XV002267,tkw,Ni-te rema revo.,,,I'm waiting for the tide.,,,,,,SN001810,
XV002268,tkw,Le-te rema le-ko none ka moioe.,,,Let's wait for the food to cook.,,,d10.Bekem:20,,,SN001810,
XV002269,tkw,Buioe pon kata ka reviñe.,,,Those areca nuts are ready to harvest.,,,DG1-40b,,,SN001811,
XV002270,tkw,abilo peini revo,,,seasnake,,,,,,SN001812,
XV002271,tkw,"Dapa kula li-abu revo, me le-labu namuko.",,,"The others slap the (sea) water, in order to catch the fish.",,,DP2-15b+,,,SN001812,
XV002272,tkw,"Ne basavono na, bwara temaka pe li-te ene bwara ka revo.",,,It's quite possible that the place where [Lapérouse] stayed has nowadays turned to sea.,,,DG2-14a,noun predicate with Perfect [ka](ka_2),,SN001812,
XV002273,tkw,Revo i-koie.,,,[the sea is coming in] The tide is rising.,,,,,,SN001813,
XV002274,tkw,Revo i-ma.,,,[the sea is dry] It's low tide.,,,DP1-33b,,,SN001813,
XV002275,tkw,"I-wene pwo v'to teve awene tae? – Tae, n-ro tae!",,,"Isn't it on the ground, close to the fire? – No, I can't see it!",,,d05.Naef:29,,,SN001816 ; SN002446,
XV002276,tkw,"Emele na, li-ro wako tamwase.",,,This woman looks really beautiful.,,,DP1-16b,,,SN001816,
XV002277,tkw,Li-romo ñe duduko we damala pe Franis.,,,They were looking through the spyglass of the French men.,,,Lap-BenTua.069,,,SN001818,
XV002278,tkw,U-rom' ene u-ejau!,,,Watch me carefully!,,,DP1-34a,,,SN001819,
XV002279,tkw,Ka i-ka i-koie ne moe ka i-romo emel’ iape i-wene teve iawo.,,,"As he walked into his house, he saw his wife lying by the fire.",,,Kaori.14,,https://doi.org/10.24397/pangloss-0003353#S14,SN001820,
XV002280,tkw,A-ro wako?,,,Do you find her beautiful?,,,DP1-33b,,,SN001821,
XV002281,tkw,Ni-romo makone iaipa wako po pi-pinoe.,,,[I see your dances (to be) good] I'm really enjoying those dances you've been performing.,,,Tamate.062,,https://doi.org/10.24397/pangloss-0003351#S62,SN001821,
XV002282,tkw,Dapa li-romo i-aiae ngasune nga ene.,,,"They find it (to be) difficult, as much as I do.",,,SW_2014-04-30.05,,,SN001821,
XV002283,tkw,U-rom' eo nara sa eo i-meli.,,,Be careful not to have you heart broken!,,,DP1-25b,romantic relationship,,SN001822,
XV002284,tkw,"Emele na, li-ro wako tamwase.",,,This woman really looks stunning.,,,DP1-16b,,,SN001823,
XV002285,tkw,"Li-romo wako, ia idi li-madau.",,,"They looked beautiful, but they were scary.",,,Tamate.162,dancing masks,https://doi.org/10.24397/pangloss-0003351#S162,SN001823,
XV002286,tkw,Dapa li-romo vilisao ka i-tobo i-ke – li-romo nga luro.,,,They suddenly saw a tornado break through the clouds – it was [long and thin] like a coconut tree.,,,Lap-Pae2.15,,,SN001824 ; SN002185,
XV002287,tkw,"Dapa na ngatene nga tevie mwaliko, tevie nga li-romo nga tadoe.",,,"These are special creatures, in part human, in part looking like spirits.",,,Tamate.076,Tamate masks,https://doi.org/10.24397/pangloss-0003351#S76,SN001824,
XV002288,tkw,rua kava,,,a kava root,,,,,,SN001825,
XV002289,tkw,aña ruene,,,the noise of the door,,,,,,SN001827,
XV002290,tkw,"Ka li-ko ruene, ka li-tabo li-bono.",,,"They open the door, and then shut it again.",,,Hell-Door.12,,,SN001827,
XV002291,tkw,Sa ene i-lipu!,,,[My bell is full] I’m full.,,,Scott Koroh,,,SN001828,
XV002292,tkw,"Nga namuko i-pono eo, kape sa eo i-meli.",,,"If a fish poisons you, your stomach will ache.",,,q.Fish.002,,,SN001828,
XV002293,tkw,None ka i-vo sa eo?,,,Has your meal filled up your tummy? (i.e. are you full?),,,DG1-46a,,,SN001828 ; SN002453,
XV002294,tkw,Nara sa i-meli!,,,Make sure you don't end up heartbroken!,,,DG2-22a + DP1-25b,,,SN001829,
XV002295,tkw,Sa ini pine.,,,[lit. her bell is big] She is pregnant.,,,,,,SN001830,
XV002296,tkw,Sa ini pine i-ve i-labu men' iape: emele.,,,"She got pregnant, and later gave birth to a baby: a girl.",,,Heron.Tnm.37,,,SN001830,
XV002297,tkw,Emele iape sa pine.,,,His wife became pregnant.,,,Kaori.04,,,SN001831,
XV002298,tkw,"Li-bi vongoro li-kamai, li-loko i-vene ne belemele li-sabisi li-maliawo boso.",,,"They picked almonds and brought them home, poured them all up on the almond shelf; then they lit a fire underneath.",,,,,,SN001833,
