ID,Language_ID,Primary_Text,Analyzed_Word,Gloss,Translated_Text,Meta_Language_ID,Comment,Corpus_Reference,Example_Comment_English,Example_URL,Sense_IDs,alt_translation1
XV000883,tkw,Ise ene i-to!,,,I have a boner!,,,DG2-22b,,,SN000674 ; SN002184,
XV000884,tkw,ne otovo iu,,,up in the thatched roof,,,,,,SN000675,
XV000885,tkw,"Moe iaba pwo; iote iu, ie mwaliko iote.",,,"Our flat is located below; as for the one above, it belongs to someone else.",,,DP1-15b,storey house,,SN000675 ; SN001336 ; SN001787,
XV000886,tkw,basa re po i-wen' iu re,,,that mountain up over there,,,Paradise.03,,,SN000675,
XV000887,tkw,Ai-ava iu ñe vakaboro?,,,Did you fly (in the sky) with a plane?,,,DG1-15b,,,SN000675,
XV000888,tkw,Li-romo i-katau vangana kanmoro iu ne meteliko.,,,We watch the light of the stars up in the sky.,,,d07.Kenu:17,,,SN000675,
XV000889,tkw,Viko iadapa li-iu.,,,They buried their shellmoney in the ground.,,,Lap-BenTua.109,,,SN000676,
XV000890,tkw,"Li-iu tepapa i-le awoiu, li-vesu bulateno i-vio.",,,"First they buried the dancing boards, then they erected the ritual pole.",,,Mwasu.013,,https://doi.org/10.24397/pangloss-0003352#S13,SN000676,
XV000891,tkw,Miko noma ka i-iu kulumoe Tetawo ne Banie.,,,"A long time ago, the village of Tetawo on Banie island was buried by an earthquake.",,,EP_2012-05-13.02,,,SN000677,
XV000892,tkw,Dapa Iura li-la vesevelae li-iu me viko.,,,People in Vanuatu thread cone shells into shellmoney.,,,AF-misc_Tea-Tik_Vanikoro-fish_2012.pdf,,,SN000678 ; SN002344,
XV000893,tkw,U-iui i-le!,,,Push it forward!,,,AF-IP1-01b,,,SN000679,
XV000894,tkw,Katae kape le-iui kuo i-abu ne revo.,,,They were about to push their canoe out to sea.,,,d07.Kenu:13,,,SN000679,
XV000895,tkw,Dapa li-ioi tovokowo ene: kuo pine ponu i-atili i-abu i-le.,,,"As they pushed the wooden rolls, the large ship slid down all the way.",,,Goblins.18,,,SN000679,
XV000896,tkw,Kape le-loko ajekele le-iui ne revo.,,,They're going to gather rubbish and throw it into the sea.,,,Funeral.08,,,SN000680,
XV000897,tkw,"I-aneve ajekele awoiu, i-loko i-lui i-iui.",,,"She swept away the rubbish, then collected it and went to throw it away.",,,Heron.Tnm.47,,,SN000680,
XV000898,tkw,"Pe li-wete telupe, u-avi visone ka u-iui diro i-le i-wete ini.",,,"When you hunt pigeons, you bend your bow, cast your arrow, and hit it.",,,q.Wud.049,,,SN000681,
XV000899,tkw,Mou me ne-iumu ne-le n-ioi teuko ko.,,,Let me first go angling.,,,d01.Rot:26,,,SN000682 ; SN000873 ; SN001394,
XV000900,tkw,iula tepuke,,,anchor of a canoe,,,DG1-30b,,,SN000686,
XV000901,tkw,iula toñaki,,,anchor of a ship,,,,,,SN000686,
XV000902,tkw,"Iula toñaki ponu, ene ni-romo ñe mata ene.",,,"That (ship) anchor, I have seen it with my own eyes.",,,Lap-BenTua.090,,,SN000686,
XV000903,tkw,U-iumu u-koie u-ka!,,,You come in first!,,,DP1-06a,,,SN000688,
XV000904,tkw,U-iumu me ne-katau eo.,,,"You go first, I'll come behind you.",,,DP1-07b,,,SN000688,
XV000905,tkw,Mou me ne-iumu ne-vongo ko.,,,Let me have dinner first.,,,DP1-06a,,,SN000689,
XV000906,tkw,"Ia ni-mui, nga u-ium’ u-viñ' ene!",,,"I didn't know, you should have told me first!",,,d12.Sintia:44,,,SN000689,
XV000907,tkw,Ni-nabe jokoro lea iune ka kula.,,,I measured the bamboo to be one fathom and a half.,,,DP1-33b,,,SN000690,
XV000908,tkw,uie kwate tamana iune,,,page thirty one,,,EP_2005-06-27.09,,,SN000690,
XV000909,tkw,rea iune tamana iune,,,one hundred and one,,,,,,SN000690,
XV000910,tkw,wik iune piote,,,one full week,,,DG1-48b,,,SN000691,
XV000911,tkw,Ka metele iune pon!,,,"Alright, it's been one moon!",,,Tamate.148,,https://doi.org/10.24397/pangloss-0003351#S148,SN000691,
XV000912,tkw,"La-te ra ra, bwara kata kape ebieve iune.",,,"They stayed there, perhaps a whole year.",,,Tamate.015,,https://doi.org/10.24397/pangloss-0003351#S15,SN000691,
XV000913,tkw,"Emele iune, ini da men’ iape, la-te ne kulumoe.",,,"[There was once] one woman, with her child, who were living in the village.",,,Toplau.02,,,SN000692,
XV000914,tkw,Li-bu awoiu. Iune i-te tae.,,,Everybody died: nobody survived. [lit. a single one wasn't there],,,Mwasu.117,,https://doi.org/10.24397/pangloss-0003352#S117,SN000693,
XV000915,tkw,"Vesepiene iune, i-vete ngatene tilu.",,,"It is the same word, but with two distinct meanings.",,,DP2-15a,,,SN000694,
XV000916,tkw,Dapa Lovoko na li-ovei pe li-la ngatene iune.,,,The Lovoko people are used to cooperating with each other [lit. working as-one],,,DP1-35a,,,SN000695,
XV000917,tkw,~le iune,,,"(be, do) the same; (go) together",,,,,,SN000695,
XV000918,tkw,Ia enon' iot' tae! Pe enone na iune na.,,,But I don't have another (knife). This is my only one.,,,d11.Wora:11,,,SN000696,
XV000919,tkw,Mwaliko iune na ka i-te.,,,There's only one man left (who can speak the language).,,,HP1-04a,,,SN000696,
XV000920,tkw,"Kape li-au, li-ngago iunubo iune iune.",,,"They will wrap [the food], fastening every parcel.",,,d10.Bekem:09,,,SN000697,
XV000921,tkw,kwa-tilu tamana iuntae,,,twenty-nine,,,DG1-12a,,,SN000698,
XV000922,tkw,Li-le ne iura.,,,They went to the heights [of the island].,,,Goblins.35,,,SN000703,
XV000923,tkw,"Vana uña toñaki i-ka i-loko dapa ne kulumoe na, dapa li-lui li-langatene ne Iura, Santo.",,,"Ships used to come to this island to collect people, and then take them away to make them work somewhere in the south, on (Espiritu) Santo.",,,Lap:Usao.01,,,SN000704,
XV000924,tkw,"Kulumoe Iura, kulumoe i-wene tev’ iu.",,,The islands of (north) Vanuatu are located southeast.,,,DG1-15a,,,SN000705,
XV000925,tkw,Li-ovei pe li-pwalau li-le Iura ne tepuke.,,,They used to travel to (north) Vanuatu on their canoes.,,,DG1-15a,,,SN000705,
XV000926,tkw,"Li-nabe na ini wako, li-vesu iuro.",,,"They first measured the ground, and then erected the pillars.",,,Toplau.81,building a house,,SN000706,
XV000927,tkw,"Li-katei bavede i-vene ne iuro, peini me le-vesu i-ke i-le.",,,"They hoisted the sail up the mast, so they could sail away.",,,d07.Kenu:15,,,SN000707 ; SN000810 ; SN001705 ; SN002333,
XV000928,tkw,iutego kuledi peini tokoli,,,shorter stilts for the floor structure,,,,,,SN000709,
XV000929,tkw,"Eo pon, ive?",,,"[lit. as for you, how's things?] What's up with you?",,,,,,SN000710,
XV000930,tkw,Ive? Ba-romo kupa wako we tamwaliko?,,,Now what? Do you like us or not?,,,Tamate.059,,https://doi.org/10.24397/pangloss-0003351#S59,SN000710,
XV000931,tkw,Aia kape i-ka ne! – Ka ive?,,,Your father's coming! – So what?!,,,xxx,,,SN000710,
XV000932,tkw,A-ko ive?,,,What did you say?,,,DG1-12b,,,SN000711,
XV000933,tkw,"Li-ka ponu, li-ko (ive?) li-wokobe da.",,,So they all came in order to… (to do what again?) …to welcome them.,,,,,,SN000711,
XV000934,tkw,A-kai lusa ene na (pe) ive?,,,But why did you tear my shirt?,,,DP2-19b,,,SN000712,
XV000935,tkw,Ive eo? Ai-etengi ñe nganae?,,,What's up with you? Why are you crying?,,,IP1-08a,,,SN000713,
XV000936,tkw,Eo a-mokoiu ai-ovili pe ive?,,,Why are you sleeping so late?,,,,,,SN000714,
XV000937,tkw,Li-waivo ene i-wene i-wene.,,,I keep learning every day.,,,DP1-28b,,,SN000715,
XV000938,tkw,li-au jebute,,,harvest taro (by pulling on it),,,,,,SN000718,
XV000939,tkw,Jebute ka moso.,,,The taros are ripe.,,,,,,SN000718,
XV000940,tkw,"Kape jebute i-karau na metae, pe ero tae.",,,"Taros can't grow here, due to lack of water.",,,,,,SN000718,
XV000941,tkw,jie bute → jebute,,,taro sucker → taro,,,,,,SN000721,
XV000942,tkw,Bele voro ini jiejie.,,,The skin of stingrays is rough.,,,DG2-20b,,,SN000722,
XV000943,tkw,Ni-toe jokoro iote me susuko me ngasune semame jokoro iote.,,,I cut a bamboo rod to the same length as the other one.,,,DP1-33b,,,SN000723 ; SN001594,
XV000944,tkw,Ni-nabe jokoro lea iune ka kula.,,,I measured the bamboo rod to be one fathom and a half.,,,DP1-33b,,,SN000723,
XV000945,tkw,Kape le-la teuko ne jokoro me le-katei ñe namuko.,,,We'll take a fishing rod and go angling.,,,d11.Wora:14,,,SN000724 ; SN000814,
XV000946,tkw,"Le-la jokoro me le-woi, me le-mako.",,,We'll take bamboos and pound them (on the ground) for the dances.,,,DP1-11a,,,SN000726,
XV000947,tkw,jokoro pe li-woi,,,[lit. bamboos to be stamped] stamping tube,,,,,,SN000726,
XV000948,tkw,jokoro pe li-vi,,,[lit. bamboos to be blown] Pan pipe,,,,,,SN000727,
XV000949,tkw,jokoro pe li-abu,,,[lit. bamboos to be struck] bamboo organ,,,,,,SN000728,
XV000950,tkw,Dameliko kape li-abu jokoro.,,,The kids will play the bamboo organ.,,,DG1-45a,,,SN000728,
XV000951,tkw,"U-toe dekele namuko, ava ka wabasa mina.",,,"You cut off the fish's tail, side fins and head.",,,,,,SN000730,
XV000952,tkw,viabasa ini ka noma ini ka mata ini,,,"her hair, her face, her eyes",,,,,,SN000730,
XV000953,tkw,"Uña teliki makumoso, ka uña teliki, ka dapa wopine peini kulumoe, ka dapa gete, ne-ko kape ne-viñi kiapa.",,,"O you supreme chiefs, you dignitaries, you leaders of our island; and you the youngsters too, I have something to tell you.",,,Tamate.095,,https://doi.org/10.24397/pangloss-0003351#S95,SN000730,
XV000954,tkw,Ni-nabe jokoro lea iune ka kula.,,,I measured the bamboo rod to be one fathom and a half.,,,DP1-33b,,,SN000730,
XV000955,tkw,"Li-aneve lema mwoe, ka maro.",,,"They sweep inside the house, and outside too.",,,DG1-33b,,,SN000730,
XV000956,tkw,ne to ñe na ka Tekupie,,,between here and Tikopia,,,Tamate.025,,https://doi.org/10.24397/pangloss-0003351#S25,SN000730,
XV000957,tkw,"Tokoli i-dobuo pe tebo, ka i-mu tamwase.",,,"The bridge is wet due to the rain, so it's very slippery.",,,HP2-01,,,SN000731,
XV000958,tkw,"Li-anu ero pana ka li-kanu, ka li-moloe ne kat.",,,"We drink tea, we chew areca nuts, and we play cards.",,,Funeral.04,,,SN000731,
XV000959,tkw,"Li-mabui li-ae tanoe, wako ka li-lateli teve.",,,"They quietly dug a hole in the ground, and put (the treasure) there.",,,Lap'Treasure_09,,https://doi.org/10.24397/pangloss-0003269#S9,SN000731,
XV000960,tkw,Kulevelu ka i-ve waluluo tete.,,,The fowl has laid three eggs.,,,xx,,,SN000732,
XV000961,tkw,Ka a-kila emele?,,,Are you married already?,,,,,,SN000732,
XV000962,tkw,Ka ni-koie.,,,I'm inside already.,,,DP1-34b,,,SN000732,
XV000963,tkw,"Mamote i-maluo, we tae? – Tae, ka i-bu.",,,"Is she still alive? – No, she's already passed away.",,,,,,SN000732,
XV000964,tkw,Ngiro ka i-lubi.,,,The wind has turned.,,,Tamate.053,,https://doi.org/10.24397/pangloss-0003351#S53,SN000732,
XV000965,tkw,"Revo ka i-koie, we ka i-ma?",,,Is it high tide or low tide?,,,,,,SN000732,
XV000966,tkw,"O io, ka ni-tabo ni-vodo!",,,"Oh yes, I remember now!",,,d12.Sintia:15,,,SN000732,
XV000967,tkw,"Ai' one ka i-bu, ebieve tua ka i-da.",,,"My father died eight years ago. [lit. he has died, eight years have passed]",,,DG1-17b,,,SN000732,
XV000968,tkw,teliki iakapa na pe ka i-re kiapa na,,,our leader who has left us today,,,,in relative clause,,SN000732,
XV000969,tkw,Jebute ka moso.,,,The taros are ripe.,,,,adjective predicate,,SN000732,
XV000970,tkw,Le-te rema le-ko none ka moioe.,,,Let's wait for the food to be cooked.,,,d10.Bekem:20,Perfect in the future,,SN000732,
XV000971,tkw,Otovo iupa ka tamwaliko.,,,Our roofing has been damaged. [lit. has gone bad],,,,adjective predicate,,SN000732,
XV000972,tkw,Ka bwogo.,,,It's night now.,,,,noun predicate,,SN000732,
XV000973,tkw,Basavono na toñaki ka moko.,,,Today the ship has turned into coral reef.,,,,noun predicate,,SN000732,
XV000974,tkw,Kiapa dapa Frans ka menuko.,,,"We and the French, we are friends.",,,Lap-BenTua.103,noun predicate,,SN000732,
XV000975,tkw,Aeve ka tili.,,,[hours are (already) five] It's five o'clock now.,,,,numeral predicate,,SN000732,
XV000976,tkw,Ka ne-koie.,,,I'm coming in (in a second).,,,DP1-34b,,,SN000733,
XV000977,tkw,"Ne ngogoro uña menuko abia, ka pe-romo p-ajau!",,,"There are many animals in the woods, be careful!",,,,,,SN000734,
XV000978,tkw,Ka u-te!,,,Good bye! [lit. you stay!],,,,greeting,,SN000734,
XV000979,tkw,U-ka ko!,,,Come here!,,,,,,SN000735,
XV000980,tkw,A-ka a-kae?,,,How did you come?,,,,,,SN000735,
XV000981,tkw,I-ka i-koie ne moe ka i-romo emel’ iape i-wene teve iawo.,,,He came in the house and he saw his wife by the fire.,,,Kaori.14,character's point of view,https://doi.org/10.24397/pangloss-0003353#S14,SN000735,
XV000982,tkw,Ba-ka ba-rom ngatene pon na!,,,Come look at that thing here!,,,Toplau.33,serial verb,,SN000735,
XV000983,tkw,Pi-ka vele?,,,Where are you coming from?,,,,,,SN000736,
XV000984,tkw,Kape ne-tabo ne-le metele iote pe kape i-ka na.,,,I'll go again next month [lit. the other month that will come].,,,DG1-07b,,,SN000737,
XV000985,tkw,U-wai i-ka!,,,Paddle this way!,,,Tamate.036,,https://doi.org/10.24397/pangloss-0003351#S36,SN000738,
XV000986,tkw,Dapa ñepe na kape le-mako i-ka.,,,They will be dancing in this direction.,,,Tamate.153,,https://doi.org/10.24397/pangloss-0003351#S153,SN000738,
XV000987,tkw,Paiu vitoko i-ka.,,,Paiou village is very close to here.,,,DP1-08b,"no motion, abstract vector",,SN000738,
XV000988,tkw,Ab' u-leng' i-ka!,,,Listen to me! (lit. hear this way),,,,,,SN000739,
XV000989,tkw,Ni-ko u-la iawo mijaka i-ka!,,,Please pass me some fire! (this way),,,Heron.Tnm.13,,,SN000739,
XV000990,tkw,Pie aipa li-atevo i-ka?,,,Did your elders tell the story to you?,,,,,,SN000739,
XV000991,tkw,Li-romo metele i-ka ra ra ra i-tomoe.,,,They watched the moon over time (lit. watched it come along) till it disappeared.,,,Tamate.148,,https://doi.org/10.24397/pangloss-0003351#S148,SN000740,
XV000992,tkw,U-wai ebele u-ka pon etapu!,,,Don't shake your body like that!,,,DG4-03a,,,SN000741 ; SN002517,
XV000993,tkw,Avtebe adapa ka i-maili i-vene kata ka vitoko kape moso.,,,Their taros had grown up and were almost ripe.,,,Tamate.108,,https://doi.org/10.24397/pangloss-0003351#S108,SN000742 ; SN001151,
XV000994,tkw,"Ka vitoko kape i-abu tanoma ini, ia i-abu i-kovi.",,,He nearly hit her face; but he missed.,,,d08.Rao:14,,,SN000743 ; SN000942,
XV000995,tkw,Kape le-kae?!,,,How were they supposed to proceed?!,,,,,,SN000744,
XV000996,tkw,I-kae eo?,,,How are you?,,,,,,SN000745,
XV000997,tkw,A-ka a-kae? – Ni-katau anoko ni-ka.,,,How did you come? – I just followed the road.,,,DP2-19a,,,SN000746,
XV000998,tkw,Kape le-te le-kae?,,,How could they have remained there?,,,Lap:Usao.39 = DG2-15a,,,SN000746,
XV000999,tkw,A-kai lusa ene na pe i-kae?,,,Why did you tear my shirt?,,,DP2-19b,,,SN000747 ; SN000749 ; SN001131,
XV001000,tkw,"Mata ini i-ledi, we i-kae?",,,Was he hungry or something?,,,,,,SN000748 ; SN002572,
XV001001,tkw,"Pon kaiawo tae, ova revo.",,,"That's not smoke, that's steam.",,,d10.Bekem:26,,,SN000750 ; SN001654,
XV001002,tkw,"Ei! Kaiawo pon! I-ke re, ne kulumoe re!",,,"Hey, look at the smoke! It's coming from over there, from that village over there!",,,Mwasu.056,,https://doi.org/10.24397/pangloss-0003352#S60,SN000750,
XV001003,tkw,mwaliko po i-kamai tamate pon,,,the man who brought the Tamate masks [to this island],,,,,,SN000753,
XV001004,tkw,Kupa pi-kamai monone apilaka ne pe-ko me pe-kamai i-wene tev' eo.,,,"We have brought here this small box, with the idea to leave it with you.",,,,,,SN000753,
XV001005,tkw,viñe kanamuko,,,clam shell,,,IP1-07b,,,SN000754,
XV001006,tkw,"Li-nge to, li-kanu buioe me puluko.",,,"They would suck on sugarcane, and also chew areca nuts with betel leaves.",,,Lupo.60,,,SN000761,
XV001007,tkw,kangele luro,,,coconut meat,,,,,,SN000763,
XV001008,tkw,kangele vongoro pe li-vo,,,fruit of Canarium almonds,,,,,,SN000763,
XV001009,tkw,kangele kome,,,the mollusc part of a giant clam,,,,,,SN000763,
XV001010,tkw,kangele iawo,,,flames (of fire),,,,,,SN000764,
XV001011,tkw,kangele teuko,,,fishing hook,,,,,,SN000764,
XV001012,tkw,Dapa noma li-vo kangele kome li-ia kome.,,,People in the past used to break giant clams and grind them into axes.,,,AF-misc_Tea-Tik_Vanikoro-fish_2012.pdf,,,SN000766,
XV001013,tkw,“Minga kape ba-le?” I-ko “Mobo.”,,,“When will you leave?” – “Tomorrow.”,,,Tamate.055,,https://doi.org/10.24397/pangloss-0003351#S55,SN000768,
XV001014,tkw,Kape ne-tabo ne-le metele iote pe kape i-ka na.,,,I'll go again next month [the other month that will come].,,,DG1-07b,,,SN000768,
XV001015,tkw,Kata kape le-tetele kape le-pinoe pon ta.,,,They were about to start dancing.,,,Tamate.129,,https://doi.org/10.24397/pangloss-0003351#S129,SN000769,
XV001016,tkw,Vitoko teve me kape le-bo.,,,They were about to start making (their canoe).,,,,,,SN000769,
XV001017,tkw,Kape le-kae?!,,,How were they supposed to proceed?!,,,,,,SN000770,
XV001018,tkw,"Ka telepakau pe na, lek’ iaidi, idi pe li-romo idi tae. Kape le-wamu idi ñe idi.",,,"In our culture, cousins must not look at each other. They must hide from each other.",,,Mwasu.051,,https://doi.org/10.24397/pangloss-0003352#S51,SN000770,
XV001019,tkw,Toñaki pine pe kape le-ke le-lui ne ngamuli tae.,,,It was not the kind of large ships that can go out into the ocean.,,,Lap:Usao.21,,,SN000771,
XV001020,tkw,U-le pon etapu! Ña leka kape i-rom' eo!,,,Don't go there! Your cousin might see you!,,,Mwasu.058,with apprehensive [ña](LX000294),https://doi.org/10.24397/pangloss-0003352#S58,SN000771,
XV001021,tkw,Mat’ eo nara kape u-wasi ñe idi ’tapu.,,,Be careful not to give (the secret) away.,,,Lap'Treasure_10,with apprehensive [nara](nara_2),https://doi.org/10.24397/pangloss-0003269#S10,SN000771,
XV001022,tkw,Nganae pe kape le-la tae.,,,They don't need to work. [lit. there isn't anything they have to ‘take’],,,Paradise.16,,,SN000771,
XV001023,tkw,"Nga u-le, ata tadoe kap' i-ejau bas' eo mumule.",,,"If you go there, the soul of spirits can make your head go crazy.",,,d06.Devil:14,,,SN000772 ; SN001936,
XV001024,tkw,"Uk' one tilu, kape ne-vete enga da metae.",,,"My in-laws, I can't say their names out loud.",,,IP1-06a,with irrealis negation [metae](metae_2),,SN000772,
XV001025,tkw,"Ruene ponu, kape nga ngele nga i-bu, kape le-lengi aña ruene pe li-ko.",,,"It's a special door: whenever someone dies, you'll hear the sound of a door being opened.",,,Hell-Door.09,,,SN000773,
XV001026,tkw,"Nga i-abu mata, kape bwara mata ini kilo ñei.",,,"If he had hit her eyes, she could have turned blind.",,,d08.Rao:15,counterfactual,,SN000773,
XV001027,tkw,Pon tadoe? Pon tepakola? Kape i-abu idi?,,,Is that a god? Is that a giant? Does he kill people?,,,Tamate.161,,https://doi.org/10.24397/pangloss-0003351#S161,SN000774,
XV001028,tkw,"Taluaito ini basa beme, kape i-padi basa ini: ne to ne, koro; ne lava tilu, kape bworo. Awoiu kape i-tabo koro pwo mijaka.",,,"The (heathen) priest had a bald head, which he would paint: white in the middle; black on each side; and then, a bit of white again underneath.",,,DG2-13b,,,SN000774,
XV001029,tkw,basavono pe da-tilu kape la-kila da,,,[lit. when two people follow each other] when there is a wedding,,,,,,SN000775,
XV001030,tkw,"Kape le-toe langasuo peini, ka nengele wamitaka.",,,"You cut out the big (canoe) rail, and then the smaller pieces.",,,,generic present with generic subject le-33,,SN000775,
XV001031,tkw,"Ewe, kape nga ponu.",,,"Yes, that must be it.",,,d09.Karen:28,"predicative, future marked",,SN000776,
XV001032,tkw,kara kava,,,kava root,,,q.Wud.013,,,SN000777,
XV001033,tkw,kara boke,,,banyan root,,,,,,SN000777,
XV001034,tkw,"Kava li-totoe, kara i-koie samame.",,,"You chop kava to small pieces, including the roots.",,,DG1-16b,,,SN000777 ; SN002231,
XV001035,tkw,"Tepapa, li-toe kara nebe.",,,"To make a stomping board, you cut a root of rosewood tree.",,,DG1-41a,,,SN000777,
XV001036,tkw,"Kape jebute i-karau na metae, pe ero tae.",,,"Taro can't grow here, because there's no water.",,,,,,SN000778,
XV001037,tkw,Ini i-karau Vonovono.,,,She grew up in the Reef Islands.,,,DP1-07b,,,SN000779,
XV001038,tkw,"Na oie ini ka wako, na ka i-karau wako.",,,"She's of a healthy size now, she has nicely put on weight.",,,,,,SN000780,
XV001039,tkw,"Kasule, li-ovei pe l-ejau ñe idi pe li-tavie.",,,Some vines are useful for sick people.,,,DG1-18b,medicine leaves,,SN000782 ; SN002006,
XV001040,tkw,Kumara ini rua kasule.,,,Sweet potatoes are the tuber of a vine.,,,HP2-01,,,SN000782,
XV001041,tkw,Kata kape le-tetele kape le-pinoe pon ta.,,,They were about to start dancing.,,,Tamate.121,,https://doi.org/10.24397/pangloss-0003351#S121,SN000793 ; SN002123,
XV001042,tkw,Udo kata kape ka moso.,,,Bananas are almost ripe.,,,,,,SN000793 ; SN001374,
XV001043,tkw,"La-te ra ra, bwara kata kape ebieve iune bwara metele tuo.",,,"They stayed there, perhaps almost a whole year, or at least six months.",,,Tamate.015,,https://doi.org/10.24397/pangloss-0003351#S15,SN000793,
XV001044,tkw,Kata ka aeve kata kape i-tavali.,,,The sun was already about to go down.,,,Mwasu.026,combined with Perfective,https://doi.org/10.24397/pangloss-0003352#S26,SN000793,
XV001045,tkw,"Noma, ni-ajau nabene; basavono na ka tae.",,,I used to smoke in the past; but now it's over.,,,DP1-09a,,,SN000794 ; SN001466,
XV001046,tkw,Katae pon.,,,It's finished.,,,,conclusion of story+,,SN000794,
XV001047,tkw,Viko iadapa katae ka i-tomoe.,,,Their treasure has disappeared.,,,Lap-BenTua.032,,,SN000795,
XV001048,tkw,Wako. Kata ka ni-ovei.,,,Alright; I've understood.,,,Toplau.19,,,SN000795,
XV001049,tkw,Katae ka kuo ponta.,,,It's [become] a canoe now.,,,DG1-12a,noun predicate,,SN000795,
XV001050,tkw,Kata ka aeve kata kape i-tavali.,,,The sun was already about to go down.,,,Mwasu.026,combined with Prospective aspect,https://doi.org/10.24397/pangloss-0003352#S26,SN000795,
XV001051,tkw,Kata ka ai-e?,,,Have you eaten this already?,,,DP2-10a,,,SN000796,
XV001052,tkw,Kata ka ni-e vivilo na!,,,This is my first time eating Cyrtosperma taro.,,,DP1-25a,,,SN000797,
XV001053,tkw,Katae ka ni-rom ponta.,,,That's when I saw her for the very first time.,,,DP2-09b,,,SN000797,
XV001054,tkw,Ba-ko ba-katau ene le-le ne toloto?,,,Do you guys want to join me to the lake?,,,,,,SN000798,
XV001055,tkw,tili' one pe i-katau ene viri,,,[my brother who follows me behind] my next brother (in age),,,,,,SN000799,
XV001056,tkw,Tilio emele pe i-katau eo?,,,Is this your younger sister?,,,DP1-13b,,,SN000799 ; SN002169,
XV001057,tkw,Kape le-tabo le-katau na kiapa ponu.,,,Let's retrace our own steps again.,,,DG1-28b,,,SN000800 ; SN001456,
XV001058,tkw,Dapa iakapa noma li-ovei pe li-pwalau: li-katau kanimoro li-le ne basakulumoe kula.,,,"Our ancestors used to practice navigation: they would follow the stars, and reach new islands.",,,DG1-15a,,,SN000800 ; SN001781,
XV001059,tkw,Noma li-katau ñe metele.,,,"In the old days, people would just refer themselves to [lit. follow] the moon.",,,,calendar,,SN000801,
XV001060,tkw,Emele pon i-katau awa ene!,,,This girl sure suits my desire! (=I dig her!),,,,hum,,SN000802,
XV001061,tkw,I-kotu i-katau ero ponu i-ven' i-le.,,,"He ran along the river, all the way up.",,,Mwasu.083,,https://doi.org/10.24397/pangloss-0003352#S83,SN000803,
XV001062,tkw,Li-elele kuo i-katau revo.,,,They dragged the boat [following the sea] along the coast.,,,Lap-BenTua.089,,,SN000803,
XV001063,tkw,"Tano ponu, li-ae mijaka me kava i-pu i-katau.",,,"This kava bowl has been hollowed out a little, to allow kava to flow along.",,,,,,SN000803,
XV001064,tkw,Le-woi okoro awoiu le-(w)oburo i-katau.,,,"We pound bamboos (giving the rhythm), and then we sing along.",,,,,,SN000804,
XV001065,tkw,"Uña toñaki van li-ka, li-ka li-dai temaka i-katau uña basakulumoe.",,,"Ships used to come and explore the area, going from one island to the other [lit. following islands].",,,Lap-Pae2.02,,,SN000805,
XV001066,tkw,"I-e idi, i-e idi, i-katau kulumoe ra ra ra ra ra ra – kulumoe moli.",,,"(the Ogre) ate people, dozens of people, going from one village to another [lit. following villages], on and on and on, until all the villages were empty.",,,,,,SN000805,
XV001067,tkw,La-tabe mata ka la-lui la-do i-katau ngogoro.,,,"They collected tree shoots, and began to plant them everywhere in the forest [lit. following the forest].",,,,,,SN000805,
XV001068,tkw,"Li-bi vongoro we teliki iote, teliki iote, i-katau dapa awoiu.",,,"They collected almonds for each chief, one after the other, enough for [lit. following] them all.",,,Tamate.099,,https://doi.org/10.24397/pangloss-0003351#S99,SN000806,
XV001069,tkw,U-ka u-te u-romo. Mata i-katau tetawene na!,,,Come sit here and look. Observe carefully [lit. let your eyes follow] these drawings!,,,,,,SN000808,
XV001070,tkw,"Basavono po le-ko li-ago idi, li-katei puro i-ke ka li-ago.",,,"When you want to shoot someone, you draw out an arrow and you shoot.",,,AF-IP1-03b,,,SN000809,
XV001071,tkw,"U-la uro, u-katei ñe wabula eo.",,,"You take charcoal powder, and rub it on your cheeks.",,,16.07.2017,,,SN000812 ; SN002280,
XV001072,tkw,mañoka pe li-katei,,,grated manioc (a dish),,,DG1-17b,,,SN000813,
XV001073,tkw,kara kava,,,a kava root,,,,,,SN000815,
XV001074,tkw,"Dapenuo li-le ne toplau, li-anu kava. Li-anu kava awoiu, ka li-vongo viri.",,,"Men would go in the men's clubhouse, and drink kava. Once they had drunk kava, they would eat.",,,Tamate.094,,https://doi.org/10.24397/pangloss-0003351#S94,SN000816,
XV001075,tkw,Daviñevi wopine li-ovei pe li-anu kava.,,,Adult women are allowed to drink kava.,,,,,,SN000816 ; SN001658 ; SN002624,
XV001076,tkw,"Tano ponu, li-ae mijaka me kava i-pu i-katau.",,,"This kava bowl (tano1) has been hollowed out a little, to allow kava to flow along.",,,,,,SN000816,
XV001077,tkw,Ngaten’ na pe i-ka kavele?,,,How did that thing end up here?,,,Toplau.55,,,SN000820,
XV001078,tkw,Kavele?,,,How's things?,,,Lap-BenTua.088,,,SN000821,
XV001079,tkw,Ka kavele?,,,How are things now?,,,Kaori.17,,,SN000821,
XV001080,tkw,Ini i-la namolo i-kawi ñe men' iape.,,,She took her cloth and put it on her child.,,,cf. Tamate.088,,,SN000822,
XV001081,tkw,Nara bwoe i-ke eo!,,,Make sure sharks don't bite you.,,,,,,SN000824,
XV001082,tkw,muko pe i-ke idi,,,[fly that bites people] mosquito,,,,,,SN000824 ; SN001690,
XV001083,tkw,U-ke u-ka na!,,,Come out!,,,,,,SN000825,
XV001084,tkw,"Li-koie ne moe, ka labiou tae, dapa ka tabo li-ke li-ka.",,,"They came into the house, but a little later, they came back out.",,,Toplau.26,,,SN000825,
