ID,Language_ID,Primary_Text,Analyzed_Word,Gloss,Translated_Text,Meta_Language_ID,Comment,Corpus_Reference,Example_Comment_English,Example_URL,Sense_IDs,alt_translation1
XV001449,tkw,"Basavono po mwaliko malaria i-vagasi, basa i-meli, mwaliko i-loro, panavono i-ke.",,,"When someone has malaria, their head aches, they vomit, they sweat…",,,,,,SN001104,
XV001450,tkw,ba loubo,,,crab's claw,,,,,,SN001107,
XV001451,tkw,utedie loubo,,,[backside of crab] crab's shell,,,,,,SN001107 ; SN002285,
XV001452,tkw,ma loubo,,,crab's hole,,,,,,SN001107,
XV001453,tkw,Loubo iote i-ke vidiviko ne ale ene.,,,I had one of my toes bitten by a crab!,,,q.Anemol.14,,,SN001107 ; SN002390,
XV001454,tkw,buia loubaido,,,[testicles of c.c.] abdomen of a coconut crab,,,,,,SN001111,
XV001455,tkw,li-labu louboaido,,,hunt for coconut crabs,,,,,,SN001111,
XV001456,tkw,Luro i-lolovei i-abu.,,,The coconuts keep falling.,,,DP2-20a,,,SN001112,
XV001457,tkw,Uie vilo i-lolovei i-abu ne tanoe.,,,The dead leaves are falling on the ground.,,,,,,SN001112,
XV001458,tkw,"Moe na, lovia tete.",,,This house has three storeys.,,,DG1-20b,,,SN001113,
XV001459,tkw,"Toñaki ie Laperus ponu, ae, tepakare. Lovia tilu, ne?",,,"Lapérouse's ship, you know, it was a catamaran. With two sections, you see?",,,Lap-Simevio.12,,,SN001113 ; SN002094,
XV001460,tkw,lovia vono tete,,,[three parts of the world] the three different worlds,,,???,,,SN001114,
XV001461,tkw,"Basavono po li-bu, kape le-tomoe mina Lovia Vono na, le-le ne Lovia Vono iote.",,,"When we die, we leave this World, and migrate to the Other World.",,,DG4-05a,,,SN001114 ; SN001739,
XV001462,tkw,piene adapa Lovono,,,the language of Lovono,,,,,,SN001116,
XV001463,tkw,"Tadoe iadapa pon, enga ini – dapa Lovono li-ko ‘Visipure’; ka dapa Teanu li-ko ‘Vilisao’.",,,"The god in question was called – in the Lovono language, (they say) ‘Fisipure’; in Teanu, ‘Filisao’.",,,Lap-Pae2.12,,,SN001116,
XV001464,tkw,"I-tau jebute awoiu ponu, i-lu.",,,"Once the taro was done, he scraped (its skin).",,,Tamate.006,,https://doi.org/10.24397/pangloss-0003351#S6,SN001117,
XV001465,tkw,Kape le-lu bete.,,,They are ready to fold their mats.,,,,,,SN001118,
XV001466,tkw,Ngiro ka i-lubi.,,,The wind has turned.,,,Tamate.053,,https://doi.org/10.24397/pangloss-0003351#S53,SN001120 ; SN001611,
XV001467,tkw,U-lubi!,,,Flip (the page)!,,,DP1-12a,,,SN001121,
XV001468,tkw,luene namuko,,,a catch of many fish,,,2020-11-12 - Ezy Prians,,,SN001123 ; SN001473,
XV001469,tkw,"Ini i-le i-la voko, i-lui i-la i-teli ne temaka iote.",,,"He [went to] grab the stone, took it away and put it down elsewhere.",,,,,,SN001124,
XV001470,tkw,Toñaki iadapa i-ka i-ka i-sava webwe i-lui.,,,Their ships used to come here to buy troca shells and take them away.,,,Lap-Mamuli.Tnm.04,,,SN001124,
XV001471,tkw,"Uña udo pe i-ako, li-lui i-avo ne tone.",,,The ripe bananas had been [taken] put to hang from the hook.,,,Toplau.47,,,SN001124,
XV001472,tkw,li-lui nuduro,,,"carry the scareline, go fishing with the scareline",,,,,,SN001124,
XV001473,tkw,Kupa pi-lui ini teve taluaito.,,,We took him to the doctor.,,,,,,SN001125,
XV001474,tkw,"Vana uña toñaki i-ka i-loko dapa ne kulumoe na, dapa li-lui li-langatene ne Iura.",,,"Ships used to come to this island to collect people, and then take them away to make them work somewhere in the south.",,,Lap:Usao.01,,,SN001125,
XV001475,tkw,Ngiro i-aka i-lui dapa.,,,The wind blew and took them away.,,,cf. Tamate.016,,,SN001125,
XV001476,tkw,lukilo vekai,,,heliconia leaf,,,,,,SN001126,
XV001477,tkw,tongolukilo,,,medicinal leaves,,,,,,SN001126,
XV001478,tkw,nga-lukilo,,,[lit. like-leaf] yellow,,,,,,SN001126,
XV001479,tkw,Toñaki i-lukubi.,,,The ship was rocking.,,,HP1-04b,,,SN001128,
XV001480,tkw,uie lupanade,,,tamanu leaves,,,DP1-23b,,,SN001129,
XV001481,tkw,U-la lusa eo i-avo ne tero.,,,Hang your shirt on the string.,,,DG1-14b,,,SN001131 ; SN002109,
XV001482,tkw,Ni-lateli ne temamene peini lusa ene.,,,I put it away in my suitcase [the basket for my clothes],,,DP1-19b,,,SN001132 ; SN002079,
XV001483,tkw,Li-vet' piene ñe ma dapa.,,,They talk with their hands.,,,Lap-BenTua.037 = IP1-06a,,,SN001134 ; SN002355,
XV001484,tkw,Webwe i-vene i-wen' ne ma dapa; loko i-vio ne ma dapa; vilitoe i-vio ne viabasa dapa.,,,"They had armbands on their arms, scented leaves on their armbands; and white flowers in their hair.",,,Mwasu.025,dancers,https://doi.org/10.24397/pangloss-0003352#S23,SN001134,
XV001485,tkw,Ai’ akapa i-tabe ma ini boso eo ka uña damiliko iono.,,,Let our Father raise his hand above you and your children.,,,SW_2014-04-30.09,blessing,,SN001134 ; SN001925,
XV001486,tkw,ma loubo,,,a crab's hole,,,DG1-48b,,,SN001135,
XV001487,tkw,moe ma tadoe,,,Devils' lair (ancestral temple),,,,,,SN001136,
XV001488,tkw,Toplau mwa gete,,,clubhouse for youngsters,,,,,,SN001136,
XV001489,tkw,Voko ma Gete,,,Youngsters' Rock,,,,,,SN001136,
XV001490,tkw,"Revo ka i-koie, we ka i-ma?",,,Is it high tide or low tide?,,,,,,SN001139,
XV001491,tkw,Abu u-vet' piene u-mabui!,,,Please talk slowly.,,,DG1-07b,,,SN001142,
XV001492,tkw,I-u ñe mabukaia.,,,He wiped his anus.,,,Goblins.17,,,,
XV001493,tkw,"Pe-madau etapu, ponu menuko iaba.",,,"Don't be scared, this is our friend.",,,Tamate.151,,https://doi.org/10.24397/pangloss-0003351#S151,SN001143 ; SN001272,
XV001494,tkw,Dapa li-madau ñe toñaki ponu.,,,They were afraid of that ship.,,,Lap-Simevio.09,,,SN001143,
XV001495,tkw,"I-bo ebele kuo; awoiu, i-made basa, ka teviri.",,,"After cutting out the canoe hull, he carved out its prow and its stern.",,,d07.Kenu:05,,,,
XV001496,tkw,Madele i-betei.,,,The clam shut itself.,,,DG2-02b,,,SN001145,
XV001497,tkw,maga ero,,,a bit of water,,,DP2-17b,,,SN001147,
XV001498,tkw,maga kerosin,,,a small quantity of kerozene,,,,,,SN001147,
XV001499,tkw,"Noma, po apali i-maili i-ven' i-ka, i-te tev' ai' iape me et' iape.",,,"In the old days, when a child grew up, he would stay with his parents.",,,,,,SN001150 ; SN002023,
XV001500,tkw,Ngogoro ka i-maili.,,,The bush has grown there.,,,DP1-31b,,,SN001151 ; SN001612,
XV001501,tkw,Pi-romo uie i-maili pine.,,,You can see how the leaves have grown big.,,,,,,SN001151 ; SN001727,
XV001502,tkw,I-mali iawo awoiu i-lui voko tilu pon i-le i-wen’ ene.,,,"She lit a fire, and put two stones upon it.",,,Mwasu.089,,https://doi.org/10.24397/pangloss-0003352#S89,SN001152,
XV001503,tkw,"Li-vo aero i-dai, me kape le-mako ne to.",,,"They erected a fence around (the village area), for us to dance in the middle.",,,Tamate.127,,https://doi.org/10.24397/pangloss-0003351#S127,SN001154 ; SN002179,
XV001504,tkw,Ba-mako ra i-vagasi vono i-sodo.,,,You danced together until dawn!,,,,disco,,SN001154 ; SN002295,
XV001505,tkw,"Tepao 'naka i-makoe, kape ne-makui ñe metae.",,,"My fishing gun is broken, I can't use it for fishing.",,,d11.Wora:13,,,SN001155 ; SN001158,
XV001506,tkw,Ni-romo makone iaipa wako po pi-pinoe.,,,I'm really enjoying those dances you've been performing.,,,Tamate.062,,https://doi.org/10.24397/pangloss-0003351#S62,SN001156,
XV001507,tkw,"Li-makui Ngabe pon, temaka po toñaki tamwaliko.",,,"They've been diving around Ngambe, at the site of the wreckage.",,,"Lap-BenTua.078, cf. DP1-15b",underwater archaeology,,SN001157,
XV001508,tkw,makumoso iono,,,your first child,,,DP1-02b,,,SN001159,
XV001509,tkw,Makumoso na? – Makumoso pon ta.,,,Is this your firstborn (child)? – That's my firstborn indeed.,,,DP1-28a,,,SN001159,
XV001510,tkw,Teliki Makumoso,,,"supreme chief, Supreme God",,,,,,SN001160,
XV001511,tkw,dameliko Malangune,,,the Malangune pixies,,,Goblins.04,,,SN001161,
XV001512,tkw,visone me puro ka malebu,,,a bow with darts and stunning arrows,,,DG1-16b,,,SN001162 ; SN001230,
XV001513,tkw,Ka i-mamei ponu ka i-maliawo ka i-wene teve.,,,"As she was feeling cold, she made a fire and lied down beside it.",,,Kaori.13,,https://doi.org/10.24397/pangloss-0003353#S13,SN001163,
XV001514,tkw,"Nga ero tae, kape i-maluo metae.",,,"Without water, it won't be able to survive.",,,d09.Karen:22,,,SN001164,
XV001515,tkw,dapa pe li-maluo,,,[those who are alive] the Living,,,Paradise.02,,,SN001164,
XV001516,tkw,"Mamote i-maluo, we tae? – Tae, ka i-bu.",,,"Is she still alive? – No, she's already passed away.",,,,,,SN001164,
XV001517,tkw,Li-katau maluo iadapa.,,,They just follow their way of life.,,,DP1-15a,,,SN001165,
XV001518,tkw,"Teliki Makumoso Banie i-waivo idi mwaliko ñe telepakau, ñe maluo.",,,The Elder God Banie instructed humans with culture and life.,,,Kava.04,,,SN001165 ; SN002056,
XV001519,tkw,Maluo iono wako.,,,I like your personality.,,,DP1-21b,,,SN001166,
XV001520,tkw,Mam tadoe Ngama,,,"the temple of spirits, in Ngama",,,Lap-BenTua.014,,,SN001167,
XV001521,tkw,Mama ini pine.,,,He has a loud voice.,,,,,,SN001168 ; SN001729,
XV001522,tkw,Ni-lengi mama Stanley ni-sai ñe mama Alex.,,,"I heard Stanley's voice, I thought it was Alex.",,,DG4-06b,,,SN001168 ; SN001839,
XV001523,tkw,U-teli mama ene se.,,,Please send her ‘my voice’.,,,DP1-55%,formula for official engagement,,SN001171 ; SN001865,
XV001524,tkw,"Li-wete jebute li-wete vongoro awoiu pon, li-ejau mama.",,,"We mash taros, we crush almonds, and make the pudding.",,,Tamate.133,,https://doi.org/10.24397/pangloss-0003351#S133,SN001172,
XV001525,tkw,"Toñaki ponu, i-mamabe tilu.",,,The ship split in two.,,,Lap-BenTua.002,,,SN001173,
XV001526,tkw,Iaero ne i-mamabe tete.,,,The river splits in three.,,,DG1-21b,,,SN001173,
XV001527,tkw,Mamdeuko po via moloe.,,,The honeyeater has red feathers.,,,DG2-16a ; Lupo.64,,,SN001174,
XV001528,tkw,Ka i-mamei ponu ka i-maliawo ka i-wene teve.,,,"As she was feeling cold, she lit a fire and lied down beside it.",,,Kaori.13,,https://doi.org/10.24397/pangloss-0003353#S13,SN001175,
XV001529,tkw,Pon mamote i-te.,,,He is still alive.,,,HP1-01b,,,SN001176,
XV001530,tkw,Mamote ni-mui.,,,I still don't know / I don't know yet.,,,DG1-12b,negative verb ([~mui](LX000274)),,SN001176,
XV001531,tkw,Ini mamote emele mwatebe.,,,She was still a young woman.,,,Saulu.10,noun predicate,,SN001176,
XV001532,tkw,Temaka mamote nedemo we ka tomoro?,,,Is it still dark? or daylight already?,,,q.Adj:39,,,SN001176,
XV001533,tkw,"Basavono ponu, mamote kulumoe Tetawo mate idi abia li-te ene.",,,"At that time, the village of Tetawo was still inhabited.",,,Saulu.27,,,SN001176,
XV001534,tkw,Li-te li-te li-ko “Mamote!”,,,"They waited, waited…, and said “No, not yet!”",,,,,,SN001177 ; SN002017,
XV001535,tkw,mana voro,,,flower of hibiscus,,,,,,SN001178,
XV001536,tkw,Mana ka i-ke.,,,[its flowers have come out] It has given flowers.,,,,,,SN001178,
XV001537,tkw,Ai-e mana luro wako?,,,Do you like eating rice?,,,DG2-22a,,,SN001181,
XV001538,tkw,ne to mane,,,in the middle of the village area,,,,,,SN001182,
XV001539,tkw,"Kape ba-woi okoro, bai-oburo ne mane.",,,"We shall pound the bamboos and sing songs, in the dancing area.",,,Tamate.142,,https://doi.org/10.24397/pangloss-0003351#S142,SN001182 ; SN002611,
XV001540,tkw,~te ne manoko,,,be in one's period,,,,,,SN001183,
XV001541,tkw,"Da viñevi nga li-te ne manoko, kape le-koie ne moe metae.",,,"When women are in their periods, it is taboo for them to come inside our houses.",,,Tamate.085,,,SN001183,
XV001542,tkw,velebie peini manioka,,,cassava starch,,,"DG2-11a, DG1-16a ; DP1-29b",,,SN001184,
XV001543,tkw,Dapa abia ne marama na awa dapa i-viane le-te wako.,,,Everybody in this world just wants to live in peace.,,,DP1-32b,,,SN001186 ; SN002026,
XV001544,tkw,Pe li-ko u-ke u-te maro etapu!,,,But they forbade you from going out!,,,Mwasu.076,with Prohibitive [etapu](etapu_3),https://doi.org/10.24397/pangloss-0003352#S76,SN001187,
XV001545,tkw,masasa ene,,,my chest,,,"q.Body.059, DP1-31a",,,SN001189,
XV001546,tkw,Mata ene tevie i-meli.,,,[lit. My eyes on one side hurt] One of my eyes is painful.,,,,,,SN001190,
XV001547,tkw,"Ene ni-mede kaipa tae, ene ni-romo ñe mata ene!",,,"I'm not lying to you, I saw it with my own eyes!",,,Lap-BenTua.090,,,SN001190 ; SN001245,
XV001548,tkw,Mata ene i-mokoiu.,,,[my eyes are asleep] I'm feeling sleepy.,,,,,,SN001190 ; SN001344,
XV001549,tkw,Mata ini kilo.,,,She's blind.,,,,,,SN001190,
XV001550,tkw,Mata da i-koie ne moe ponu la-romo.,,,[their eyes went into the house] They looked into the house and then saw it.,,,,,,SN001191,
XV001551,tkw,Mata i-katau tetawene na!,,,Observe carefully [lit. let your eyes follow] these drawings!,,,,,,SN001191,
XV001552,tkw,Mata ene i-ledi.,,,I feel hungry!,,,,,,SN001193,
XV001553,tkw,mata pele,,,net mesh,,,,,,SN001194,
XV001554,tkw,mataruene,,,"opening of door, doorway",,,,,,SN001194,
XV001555,tkw,ne mata moe 'none,,,in my forecourt,,,,,,SN001196,
XV001556,tkw,mata luro,,,germinated coconut,,,,,,SN001198,
XV001557,tkw,mata bule,,,taro shoot,,,,,,SN001198,
XV001558,tkw,mata diro,,,tip of arrow,,,,,,SN001199,
XV001559,tkw,Mata eo na u-le ne tevie tawo.,,,Make sure you don't walk on that side.,,,DG1-09a,,,SN001203,
XV001560,tkw,"A-lebie pon, mata eo na u-ajau ene ne-dobuo!",,,"As you're bathing, make sure you don't get me wet!",,,HP1-08a,,,SN001203,
XV001561,tkw,Mat’ eo nara kape u-wasi ñe idi ’tapu.,,,Be careful not to give (the secret) away.,,,Lap'Treasure_10,,https://doi.org/10.24397/pangloss-0003269#S10,SN001203 ; SN002557,
XV001562,tkw,Matailo iono enaka!,,,I want your sex!,,,q.Body.086 ; DG1-07b ; DG2-22b,from a man to a woman,,SN001213,
XV001563,tkw,mataña jebute,,,taro shoot,,,,,,SN001217,
XV001564,tkw,"Mata piene pon, i-wene moli teve dapa.",,,That way of life was easy to them.,,,,,,SN001218,
XV001565,tkw,Li-waivo idi wopine kula pe li-sube ñe matapiene kula.,,,They teach those initiates who may have erred in their behaviour.,,,DG4-04a,initiates’ clubhouse,,SN001218 ; SN001899,
XV001566,tkw,Ni-woi tanoma ene ne matarone.,,,I banged my forehead on the door.,,,q.Body.023,,,SN001219,
XV001567,tkw,Ba-te ne mataruene pon.,,,We'll stay in the doorway.,,,Mwasu.059,,https://doi.org/10.24397/pangloss-0003352#S59,SN001219,
XV001568,tkw,matavo pe i-ovo i-ke,,,a bubbling spring,,,DG1-25a,,,SN001222,
XV001569,tkw,Kape i-la mawene i-kamai i-tate.,,,She can take a (coconut-leaf) mat and lay it on the ground.,,,Dragging_Canoe.39,,https://doi.org/10.24397/pangloss-0003350#S39,SN001229,
XV001570,tkw,uña momoso me dameliko,,,women and children,,,d06.Devil:18,,,SN001230 ; SN001363 ; SN002270,
XV001571,tkw,ai’ iape me ete iape.,,,her parents [her father and her mother],,,Saulu.22,,,SN001230,
XV001572,tkw,añaña longe me labaro,,,small firewood and coconut coir,,,d10.Bekem:12,,,SN001230,
XV001573,tkw,Li-kanu buioe me puluko.,,,They would chew areca nuts with betel leaves.,,,Lupo.60,,,SN001230,
XV001574,tkw,U-ko ruene me ne-ke!,,,Open the door so I can go out.,,,Mwasu.057,,https://doi.org/10.24397/pangloss-0003352#S57,SN001231,
XV001575,tkw,U-ka me la-le na!,,,"Come, let's go!",,,Mwasu.070,,https://doi.org/10.24397/pangloss-0003352#S70,SN001231,
XV001576,tkw,"Dapa li-woi nuduro ne touro, me i-botongo temaka.",,,"They put up taboo signs on the seashore, to protect the area (from poachers).",,,DP2-15b+,,,SN001231,
XV001577,tkw,Li-tabe i-le i-wene ne aeve me kokoro.,,,They bring it out to lie in the sun so it dries up.,,,IP1-06b,,,SN001232,
XV001578,tkw,"Kava li-totoe, li-wete me wamtaka.",,,"You dice up the kava, you grind it into small bits [lit. grind it so it's small].",,,DG1-16b,,,SN001232,
XV001579,tkw,Li-viane tepapa me aña ini.,,,They jump on the (dancing) boards for the sound it makes.,,,DG1-40a,,,SN001233,
XV001580,tkw,Li-ejau iadiro peini otovo me iebe.,,,You can turn (a bunch of) sago midribs into a broom.,,,AF-IP1-03a,,,SN001234,
XV001581,tkw,Dapa Iura li-la vesevelae li-iu me viko.,,,People in Vanuatu thread cone shells into shellmoney.,,,AF-misc_Tea-Tik_Vanikoro-fish_2012.pdf,,,SN001234,
XV001582,tkw,ero me ene,,,my water,,,,,,SN001235,
XV001583,tkw,Ebele kuo me!,,,What a beautiful ship!,,,,,,SN001237,
XV001584,tkw,Ebel’ ini me!,,,Really brilliant!,,,,,,SN001237,
XV001585,tkw,"Li-vo aero i-dai, me kape le-mako ne to.",,,"They erected a fence around (the village area), for us to dance in the middle.",,,Tamate.127,,https://doi.org/10.24397/pangloss-0003351#S127,SN001238,
XV001586,tkw,Li-te ne pwama iaero re ka li-ko me kape li-apilo toñaki.,,,"They stayed by the river, with the plan to build a ship.",,,Lap'Message_01,,https://doi.org/10.24397/pangloss-0003270#S1,SN001238,
XV001587,tkw,I-ko me kap’ emel’ iape pon ta.,,,He wanted her to become his wife.,,,Mwasu.065,,https://doi.org/10.24397/pangloss-0003352#S65,SN001239,
XV001588,tkw,Ene awa ene ni-ko me kape l-apilo sekele.,,,I want them to work at their gardens.,,,Tamate.097,,https://doi.org/10.24397/pangloss-0003351#S97,SN001239,
XV001589,tkw,Li-mako i-le i-le i-le – me kape bwogo.,,,They danced on and on – until night was ready to fall.,,,Lupo.32,,,SN001240,
XV001590,tkw,"Li-sava webwe li-lui, li-sava mebele.",,,"They buy troca shells, they buy sea cucumbers…",,,Lap-Mamuli_Tnm.05,,,SN001242,
XV001591,tkw,Buro pe li-mede idi ñei.,,,It's a song for leading (the dancers).,,,xxx,,,SN001244,
XV001592,tkw,U-mede kupa etapu!,,,Don't deceive us!,,,,,,SN001245,
XV001593,tkw,Ñara kape ne-med’ eo!,,,I wouldn't want to mislead you (by making a mistake).,,,DP1-19b,,,SN001245,
XV001594,tkw,Kape le-la none me le-mede ñe namuko.,,,We'll take some food and use it to lure the fish.,,,cf. DP1-16a,,,SN001246,
XV001595,tkw,"Nga pe-le, pe-lui pana etapu, pe-lui medigo.",,,"In life, don't go around with heat [anger]; you go around with cool [peace].",,,,proverb,,SN001249,
XV001596,tkw,"Tepoe, pi-ejau peini melevele.",,,We prepare 'tepoe' biscuits in case of a disaster.,,,DP1-02b,,,SN001252 ; SN002106,
XV001597,tkw,"Velebie peini otovo, peini melevele pine.",,,Sago starch is good in case of a major famine.,,,DP1-29b,,,SN001252 ; SN002326,
XV001598,tkw,"Komoudo, va li-vai kokoro me peini melevele.",,,"Clam shells are commonly dried in the fire, and preserved in case of a famine.",,,DP1-25b,,,SN001252 ; SN002297,
XV001599,tkw,Ero i-abu ne melevoko.,,,The river is falling from the cliff.,,,,cascade,,SN001255,
XV001600,tkw,Basa ene i-meli.,,,I have a headache.,,,,,,SN001256,
XV001601,tkw,Nara sa i-meli!,,,Make sure you don't get tummy ache (i.e. don't end up heartbroken!),,,,,,SN001256,
XV001602,tkw,Nganae kape li-lengi melia dapa ñe tae.,,,Nothing can cause them any pain.,,,Paradise.16,Paradise,,SN001257 ; SN001588,
XV001603,tkw,da-tilu meliko wamtaka,,,two small children,,,DG1-12a,,,SN001258,
XV001604,tkw,Ije ene memia.,,,I feel a bitter taste.,,,DP2-18b,,,SN001261,
XV001605,tkw,"Dapa pe li-anu kava, li-e vebe ñe ponu, me kape ije dapa memia etapu.",,,"Kava drinkers eat cutnut right after it, to take away the bitter taste. [lit. for fear their teeth might taste-bitter]",,,,,,SN001261,
XV001606,tkw,"Awa eo i-viane? – Tae, ni-mene!",,,"Do you want it? – No, I don't (want it).",,,,,,SN001262,
XV001607,tkw,Ero pana na ni-mene.,,,I don't want that tea.,,,CG1-02b,,,SN001262,
XV001608,tkw,“U-ka me la-le na!” Emele pon i-mene.,,,"“Come, let's go!” But the woman refused.",,,Mwasu.070,,https://doi.org/10.24397/pangloss-0003352#S70,SN001263,
XV001609,tkw,A-mene pe u-e none ponu?,,,Aren't you tired of eating that food?,,,DP1-18b,,,SN001264 ; SN001532,
XV001610,tkw,Menu ka i-re tengiro.,,,The baby was shedding tears.,,,,,,SN001265 ; SN001797,
XV001611,tkw,Ne metele tilu-tae kape i-ve menu.,,,She will give birth in August.,,,,,,SN001265 ; SN002315,
XV001612,tkw,Ni-p' ene tamwase ñe men' iamela.,,,Congratulations on your baby!,,,d12.Sintia:50,,,SN001266,
XV001613,tkw,menu emele ie teliki,,,[child female of chief] the chief's daughter,,,,,,SN001266 ; SN002065,
XV001614,tkw,men’ ie anuele,,,baby turtle (name of a bird),,,DP1-14b,,,SN001267,
XV001615,tkw,"Vono i-sodo, ka menuko i-mo.",,,"The dawn came, and birds began singing.",,,Lupo.45,,,SN001269 ; SN001322 ; SN001882,
XV001616,tkw,kasule we menuko,,,[lit. vine for birds] k.o. creeper,,,,,,SN001269,
XV001617,tkw,Bavede i-vio ne menuko.,,,The sail stands on the prow.,,,DG1-15b,,,SN001271,
XV001618,tkw,menuko 'non' tilu,,,my two friends,,,DP1-19a,,,SN001272,
XV001619,tkw,"Awisi pine, menuko!",,,"Thanks so much, my friend!",,,,,,SN001272,
XV001620,tkw,Kiapa dapa Frans ka menuko.,,,"We and the French, we are friends.",,,Lap-BenTua.103,predicate,,SN001272,
XV001621,tkw,Ka i-te teve menuko?,,,Has she got a boyfriend already?,,,,,,SN001273,
XV001622,tkw,Li-lateli ne mengela vilo.,,,They put it on a stick.,,,HP2-02a,,,SN001276,
XV001623,tkw,Labiou metae.,,,It won't take long.,,,,,,SN001277,
XV001624,tkw,"Tepao 'naka i-makoe, kape ne-makui ñe metae.",,,"My fishing gun is broken, I can't use it for fishing.",,,d11.Wora:13,,,SN001278,
XV001625,tkw,Kape ne-vete susuko metae.,,,I'd be unable to tell the exact story.,,,,,,SN001278,
XV001626,tkw,Kape u-tavie metae.,,,You can't get sick.,,,DP1-29a,,,SN001279,
XV001627,tkw,"Uk' one tilu, kape ne-vete enga da metae.",,,"My in-laws, I can't say their names out loud.",,,IP1-06a,naming taboo,,SN001280,
XV001628,tkw,Kap' i-wene metae.,,,It shouldn't be there.,,,HG1-01b,,,SN001281,
XV001629,tkw,"Keba ba-bwatui ba-ko ba-mata ini, ia metae.",,,"We tried to rock him (asleep), but no way!",,,,,,SN001282,
XV001630,tkw,Dapa ne temotu tilu pon li-la kuo li-ko me le-wai i-koie tetakoie: metae!,,,"The people on the two islets took to their canoes, hoping to paddle towards the (main) island – to no avail.",,,Mwasu.115,,https://doi.org/10.24397/pangloss-0003352#S115,SN001282,
XV001631,tkw,U-met' ene etapu!,,,Don't shy away from me!,,,DP1-23a,,,SN001283,
XV001632,tkw,"Mwasu ponu, ini mwaliko pe i-metei dapa ne ini tae.",,,That Mwasu was a person who felt no shame with his relatives.,,,Mwasu.043,,https://doi.org/10.24397/pangloss-0003352#S43,SN001283,
XV001633,tkw,Emel' enone i-mete ini pe i-rom dokta.,,,My wife is too shy to see the doctor.,,,DP1-23a,,,SN001284,
XV001634,tkw,kulaña metele,,,half moon; semi-circle,,,DG1-41a,,,SN001285,
XV001635,tkw,"Noma li-katau ñe metele po li-romo metele i-ka ra ra ra i-tomoe, li-ko “Ka metele iune pon!”",,,"In the olden days, people would follow the changes of the moon; and when it finally disappeared, they would say “Alright, it's been one moon!”",,,Tamate.148,,https://doi.org/10.24397/pangloss-0003351#S148,SN001285,
XV001636,tkw,noma metele,,,[face of the month] end of the month,,,,,,SN001286,
XV001637,tkw,ne metele iote ka i-le awoiu,,,last month,,,d02.Krae:13,,,SN001286,
XV001638,tkw,ne metele tilu-tae,,,[in eighth month] in August,,,,,,SN001286,
XV001639,tkw,~kovi metele,,,[lit. miss months] be pregnant,,,,,,SN001286,
XV001640,tkw,Li-romo i-katau vangana kanmoro iu ne meteliko.,,,We watch the light of the stars up in the sky.,,,d07.Kenu:17,,,SN001287,
XV001641,tkw,Temotu tilu ponu i-metelu.,,,The two islets were engulfed (in the disaster).,,,Mwasu,,,SN001288,
XV001642,tkw,U-re mevia eo mijaka!,,,Take some rest!,,,DP1-11b,,,SN001292,
XV001643,tkw,Ni-le ne revo nanana ni-romo meviko takataka.,,,"I was at sea today, and saw a sea krait.",,,,,,SN001295 ; SN001474,
XV001644,tkw,miakaia mwaele,,,smell of ginger,,,q.Wud.103,,,SN001298,
XV001645,tkw,Ni-lengi mie namuko.,,,I smell fish smell.,,,DP1-32b,,,SN001300,
XV001646,tkw,"Li-e ngatene pe mie, li-ko “te masi”.",,,"The food they eat is smelly, they call it “te masi”.",,,DP2-06b,,,SN001301 ; SN001598,
XV001647,tkw,U-le u-mikae?,,,What are you going to do?,,,d01.Rot:08,,,SN001303,
XV001648,tkw,I-mukae ne eo?,,,What did he do to you?,,,HP1-08a,,,SN001303,
XV001649,tkw,"Bwara ka li-ae tanoe we, ka li-mukae?",,,"They must have dug the ground, or what?",,,Goblins.37,,,SN001304,
XV001650,tkw,Na kape kupa pe-mikae toñaki na?,,,What shall we do with that ship?,,,Lap-Rub_Lvn.12,,,SN001305,
XV001651,tkw,Nobwogo miko i-la i-wai moe ne.,,,Last night an earthquake shook the houses here.,,,DG4-04,,,SN001306 ; SN001514,
XV001652,tkw,"Uña namolo enone po ai-abu ka mimione? – Tae, mamote i-dobuo.",,,"My clothes that you washed, are they dry yet? – Not yet, they're still wet.",,,q.Adj:41,,,SN001308,
XV001653,tkw,"Nga le-vilu ñe kuo, we le-vesu bavede ñi nga ponu, wako pe mimione.",,,"If people travel on their canoe, or sail on it, it's better for (the wood) to be light.",,,Dragging_Canoe.04,,,SN001309,
XV001654,tkw,"Dapa wopine na li-vete piene ne “ebele ini!” tamwase, pe li-ko motoro. Ia piene “wako” pon, mimione.",,,The elders very often use this expression “it's wonderful”: they find it a nice [lit. heavy] word. Whereas a word like “alright” is a bit too common. [it's light],,,DP1-28a,,,SN001310 ; SN001388,
XV001655,tkw,Somu tamwase mina kupa.,,,It's too far away from us.,,,,locative sense,,SN001311 ; SN001886,
XV001656,tkw,Le-wamu piene mina dapa.,,,Let's keep our discussion secret from them.,,,DP1-34a,figurative,,SN001311 ; SN002550,
XV001657,tkw,Li-la uo li-ta bele mina.,,,They're peeling off the skin of yams.,,,,,,SN001312,
XV001658,tkw,"Li-loko aero we anive, li-si kangele i-ke mina.",,,"They collect cone shells, and cut off the mollusc part.",,,HP2-02b,,,SN001312,
XV001659,tkw,"Nga u-katei namuko iote, u-toe dekele mina.",,,"If you catch a fish, you must chop off its tail.",,,,,,SN001312,
XV001660,tkw,"Dapa li-la laviko, namolo, kangele teuko, li-la li-mini kupa.",,,"They would take pearls, clothes, fish hooks, and give them to us.",,,Lap-BenTua.038,,,SN001315,
XV001661,tkw,U-ko ruene u-mini ini.,,,Open the door for her.,,,Cf. Hell-Door.14,,,SN001316,
XV001662,tkw,Kape le-wabe le-mini dapa po li-anu kava.,,,They would serve (fruit) to those who were drinking kava.,,,Kava.13,,,SN001316,
XV001663,tkw,Gi' one iote i-bo kuo i-mini dapa ne kulumoe.,,,My uncle creates canoes for the villagers.,,,d07.Kenu:01,,,SN001316,
XV001664,tkw,tanoe pe li-nabe li-mini dapa,,,the territory that had been assigned to them,,,EP_2005-06-27.16,,,SN001316,
XV001665,tkw,Li-le li-la ngatene li-mini dapa damala.,,,They travelled to work for (the benefit of) White people.,,,Cf. Lap-Rub_Lvn.02,Blackbirding,,SN001316,
